Book Id,Title,Sort Character,Primary Author,Primary Author Role,Secondary Author,Secondary Author Roles,Publication,Date,Review,Rating,Comment,Private Comment,Summary,Media,Physical Description,Weight,Height,Thickness,Length,Dimensions,Page Count,LCCN,Acquired,Date Started,Date Read,Barcode,BCID,Tags,Collections,Languages,Original Languages,LC Classification,ISBN,ISBNs,Subjects,Dewey Decimal,Dewey Wording,Other Call Number,Copies,Source,Entry Date,From Where,OCLC,Work id,Lending Patron,Lending Status,Lending Start,Lending End
253722816,Detective Files File 1 Part 1,1,"Gomez, Tamii",,,,PSICOM Publishing Inc.,2018,,,"Amber Sison is just an ordinary high school student until she found herself sticking her nose in a poisoning case at school along with the new transferee, Gray Ivan Silvan. They continued solving cases on and off campus.[return]Then comes her worst nightmare; they were not dealing with just simple people, but a dangerous mafia. [return]Amber resorts to action that puts her life in jeopardy, but she was protected by ""Zeus"", one of the mafia. His mysterious identity raises more questions. The more she unearths about him, the more baffled she becomes, as her search for answers leads her to someone she never thought he is.[return]Will Amber uncover the truth?",,Detective Files File 1 Part 1 by Tamii Gomez (2018),Paperback,256 p.; 7.87 inches,,7.87 inches,,,7.87 inches,256,,[2023-12-03],,,54,,"SHINICHILAAAABS, Wattpad",Your library,"Tagalog, English",,,[9786214141166],"9786214141166, 6214141166",,,,,1,manual entry,[2023-12-04],,,31337897,(No name),,,
253723205,Quarantine,1,"Alba, Lenard S.",,,,Lifebooks,2020,,,"Due to the rapid spread of an unknown virus that causes a malfunction to human lungs resulting to severe coughing, difficulty in breathing, blood vomiting and redness of eyes that can eventually lead to death, the Philippine government decided to quarantine the entire city of Manila by locking down every possible exit to further prevent the infection from spreading. As the mysterious disease continues to wreak havoc, Sarah who is a police woman and the lead survivor, together with her comrades struggles to escape from the city to save themselves from the ongoing catastrophe. But as they go on to their journey, they will discover things that are bizarre, unbelievable, and cannot be easily explained by science.",,Quarantine by Lenard S. Alba (2020),Paperback,,,,,,,256,,[2023-12-03],,,55,,,Your library,"Tagalog, English",,,[9789719648805],9789719648805,,,,,1,manual entry,[2023-12-04],,,31337929,(No name),,,
253723619,Olympus Academy,1,"Cabañero, Mariam Jubel H.",,,,PSICOM Publishing Inc.,2021,,,"Abigail Young is a student recently expelled from her school and it will only take a day for her world to change. As a new member in Olympus Academy, the first school to house Filipino demigods, she has to cope with the sudden shift of her reality quickly. She also needs to accept the fact that she's someone who belongs to this new realm.[return]It takes strong will to accept and a kind heart to understand her new reality... but it takes more than just will and heart to fight against a threat that has been waiting. Along with others, they will be exposed to a big event that is bound to destroy their only sanctuary.[return]Armed with purpose and their god-inherited abilities, the demigods will have to dive deep into a mission that is given not to the strongest, but to the chosen.",,Olympus Academy by Mariam Jubel H. Cabañero (2021),Paperback,,,,,,,255,,[2023-12-03],,,56,,,Your library,"Tagalog, English",,,[9786214142569],"9786214142569, 6214142561",,,,,1,manual entry,[2023-12-04],,,31337977,(No name),,,
253724149,Location Unknown,1,pinutbutterjelli,Author,,,Lifebooks,2021,,,"For Averill, it was a constant routine to stand over a field of dead bodies during the 1899 Tirad Pass War. Since namatay na ang lalaking palagi niyang binibisita sa 19th century, iyon na lang ang lagi niyang binabalikan. Ang gagawin niya lang ay mag-iwan ng bouquet ng white lilies sa nagaagaw-buhay na binata at hintayin bago ito tuluyang mamatay. It was constant. It was routine. Tumatakbo siya roon dahil masyado nang mahirap lupigin ang panahon para sa kanya.[return]It was too hard that she even considered to just up and kill herself. After she got saved by a voice, she returned with a new hope. She got help and decided to never return. But when someone triggered her time travelling tendencies, she went back to 1899. It was sickening at most but she easily returned. Ang hindi niya lang alam ay may kung sinong sumunod sa kanya.",,Location Unknown by pinutbutterjelli (2021),Paperback,464 p.; 7 inches,,7 inches,,4.5 inches,7 x 4.5 inches,464,,[2023-12-03],,,57,,"Wattpad, Taglish, bilingual, Tagalog, English",Your library,"Tagalog, English",Multiple languages,,[9789719648888],"9789719648888, 9719648880",,,,,1,manual entry,[2023-12-04],,,31338034,(No name),,,
253724398,Dekada '70,1,"Bautista, Lualhati",,,,"Anvil Publishing, Inc.",2018,,,"Si Amanda Bartolome ay isang pangkaraniwang babae—asawa ni Julian at ina ng limang anak na lalaki. Sa kanilang subdibisyon, pinakamalaking problema na niya ang mga kapitbahay nilang hindi na natapos magreklamo tungkol sa mga malokong batang Bartolome.[return]Ngunit ang panahon ng martial law ay hindi pangkaraniwang panahon. Sa pangunguna ng panganay nilang si Jules at ang kanyang pagsabak sa madugong rebolusyon, di maiiwasang harapin ng pamilya ang karahasan ng batas militar. Habang ang kanyang mga anak ay hinuhubog ng malagim na dekada, at nahahanap ang kanya-kanyang sariling adhikain sa gitna ng kaguluhan, tinatanong at tinutuklas din ni Amanda ang sarili kung ano nga ba ang kanyang tungkulin at kakanyahan bilang ina, bilang babae, bilang Pilipino.[return][return]Si LUALHATI BAUTISTA ay nagsimulang magsulat sa edad na disisais. Ang mga unang kuwento niya’y nailathala sa Liwayway at sa mga antolohiya ng maiikling kuwento. Nakamit niya ang unang gantimpala sa Palanca para sa mga nobelang ’Gapô (1980), Dekada ’70 (1983), at Bata, Bata . . . Pa’no Ka Ginawa? (1984), liban pa sa mga Palanca na nakamit niya para sa mga maiikling kuwento.[return]Nagsusulat din siya sa telebisyon at pelikula. Dumanas na siya ng pagka-ban ng sensor sa dulang Daga Sa Timba ng Tubig na idinerehe ni Lino Brocka. Ang Sakada na pelikulang tumatalakay sa kalagayan ng mga sugar workers at pinagtulungan nila ng isa pang screenwriter, si Oscar Miranda, ay kinumpiska ng militar sa mga unang taon ng martial law. Gayunman, ang unang solong pelikula niya, ang Bulaklak sa City Jail, ay nagkamit ng karangalang best story at best screenplay sa Metro Manila Film Festival sa taong 1984 at best screenplay sa Film Academy Awards.[return]Noong 2017, pinarangalan siya ng Gawad Dangal ni Balagtas ng Komisyon sa Wikang Filipino.",,Dekada '70 by Lualhati Bautista (2018),Paperback,177 p.; 8 inches,0.64 pounds,8 inches,,5 inches,8 x 5 inches,177,,[2023-12-03],,,58,,classic,Your library,Tagalog,Tagalog,PL6058.B39 D45,[9789712737817],"9789712737817, 9712737810",,899.2113,"Literature > Literature of other languages > Malay and Austronesian languages > Other Literature: Pacific Islands, Basque, Artificial Languages, Georgia, Mesopotamia   > Philippine languages > Tagalog (Filipino) > Tagalog fiction",,1,manual entry,[2023-12-04],,,8457145,"D, Cathy",Checked out,4/27/2024,5/11/2024
253724812,Bone Talk,1,"Gourlay, Candy",,,,"Anvil Publishing, Inc.",2021,,,"Isandaang taon na ang lumipas, isang batang nagngangalang Samkad ang nag-aakalang alam niya na ang lahat. Alam niya ang bundok na kaniyang tirahan. Kilala niya ang kaniyang tribu. Kilala niya ang kanilang kaaway na mortal, ang mga Mangili. Gusto niyang maging isang ganap na lalaki, mabigyan ng sarili niyang kalasag, sibat at palakol panlaban. Si Luki, ang matalik niyang kaibigan, ay gusto rin ng lahat ng ito — iyon nga lang ay babae siya, at walang babaeng nagiging mandirigma kahit kailan.[return]Pero magbabago ang lahat sa pagdating ng isang batang lalaki sa nayon. Sinasabi niyang kapatid niya si Samkad, pero wala siyang nalalaman tungkol sa buhay sa kabundukan. May dala siyang balita tungkol sa mga tinatawag na “Amerikano,” na sa kanilang pagdating sa nayon ay may dalang gulo at digma…",,Bone Talk by Candy Gourlay (2021),Paperback,235 p.; 8 inches,0.47 pounds,8 inches,,5 inches,8 x 5 inches,235,,[2023-12-03],,,59,,translation,Your library,Tagalog,English,PR9550.G68 B66,[9789712735936],"9789712735936, 9712735931",,823.92,2000- > English > English fiction > Literature > Modern Period,,1,manual entry,[2023-12-04],,,22616657,(No name),,,
253725058,The Bamboo Stalk,5,"Alsanousi, Saud",Author,"Recato-Daño, Jen",Translator,"Anvil Publishing, Inc.",2021,,,"May mukha ng Pilipino, pasaporte ng Kuwaiti, apelyido ng Arabo, at isang pangalang Kristiyano.[return]Lumaki si Jose na sinisikap intindihin ang kaniyang dalawang pagkakakilanlan at kumakapit siya sa pag-asang makabalik siya sa bansa ng kaniyang ama pagdating ng edad na labing-walo. Ngunit tatanggapin ba si Jose ng bansa at pamilya ng kaniyang ama? Handa na ba siyang sumuong sa mundo kung saan mas mahalaga ang sasabihin ng ibang tao?[return]The Bamboo Stalk ay ang kauna-unahang libro ni Saud Alsanousi na isinalin sa Filipino. Isang nakabibighaning kuwento na matapang na tinatalakay ang paksa ng pagkakakilanlan, lahi, at relihiyon.",,The Bamboo Stalk by Saud Alsanousi (2021),Paperback,364 p.; 8 inches,0.72 pounds,8 inches,,5 inches,8 x 5 inches,364,,[2023-12-03],,,60,,translation,Your library,Tagalog,English,,[9789712736957],"9789712736957, 9712736954",,,,,1,manual entry,[2023-12-04],,,28609357,(No name),,,
253725590,Kaibigan Ko ang Buwan - Big Book,1,"Litiatco-Acosta, Chie",Author,"Advincula, Mela",Illustrator,"Adarna House, Inc.",2019,,,"Bawat gabi, hinahanap ng isang batang babae ang kaibigan niya, ang buwan.[return]Tuwing nag-iiba ang buwan, nagbabago rin ang nakikita niyang kakatuwang larawan.[return]Silipin ang kaniyang mga guni-guni sa lahat ng pagbabagong-anyo ng buwan.",,Kaibigan Ko ang Buwan - Big Book by Chie Litiatco-Acosta (2019),Big Book,32 p.; 17 inches,0.59 pounds,17 inches,,11 inches,17 x 11 inches,32,,[2023-12-03],,,61,,big book,Your library,"Tagalog, English",Tagalog,,[9789715087773],"9789715087773, 9715087779",,,,,1,manual entry,[2023-12-04],,,31338200,(No name),,,
253725908,Ang Mutya ng Section E,1,eatmore2behappy,Author,,,PSICOM Publishing Inc.,2019,,,"Ang tanging gusto lang ni Jay-jay ay magkaroon ng normal na high school life, na malayo sa dating siya na laging nakikipag-away, kaya naman pumayag siyang lumipat sa poder ng kanyang kamag-anak sa pagbabakasakali na makapagbabagong-buhay.[return]Hawak ang pangako na 'yon, pumasok siya sa kanyang bagong school pero kahihiyan at sakit sa ulo naman ang bumungad sa kanya.[return]Matupad kaya niya ang kanyang pangako at makatagal kaya siya sa nilipatang school kung siya lang ang nag-iisang babae sa section nila?",,Ang Mutya ng Section E by eatmore2behappy (2019),Paperback,351 p.; 8.26 inches,,8.26 inches,,,8.26 inches,351,,[2023-12-03],,,62,,"Wattpad, Taglish, bilingual, fiction, novel, mature content",Your library,"Tagalog, English",Multiple languages,,[9786214141722],"9786214141722, 6214141727",,,,,1,manual entry,[2023-12-04],,,31338239,(No name),,,
253726164,Ang Alaga,1,"Canong-Senosin, Katrina",Author,"Tiongco, Donna",Illustrator,Brille Petit,2021,,,Pipit kayang madaldal o itik na makulit? Tuta kayang malikot o kuting na masungit? Alamin ang bagong alaga sa bahay ni Kuya.,,Ang Alaga by Katrina Canong-Senosin (2021),Paperback,16 p.; 9 inches,,9 inches,,8.25 inches,9 x 8.25 inches,16,,[2023-12-03],,,63,,,Your library,Tagalog,Tagalog,,[9786214381814],"9786214381814, 6214381817",,,,,1,manual entry,[2023-12-04],,,31338257,(No name),,,
253726441,Boy Kendeng,1,"Agsaway, Dominic",Author,"Agsaway, Dominic",Illustrator,"Adarna House, Inc.",2021,,,Mayroon akong lihim. Ayaw ko munang sabihin...[return]Ito ay rekomendado sa mga batang edad 6 pataas.,,Boy Kendeng by Dominic Agsaway (2021),Paperback,32 p.; 9 inches,0.22 pounds,9 inches,,7 inches,9 x 7 inches,32,,[2023-12-03],,,64,,,Your library,Tagalog,Tagalog,,[9789715088626],"9789715088626, 9715088627",,,,,1,manual entry,[2023-12-04],,,31338275,"R., Jett",Checked out,4/6/2024,5/5/2024
253726716,Ang Unang Barangay,1,"Almario, Virgilio S.",Author,"Mikel, Jap",Illustrator,"Adarna House, Inc.",2022,,,"Bago pa man dumating ang mga Español, mayroon nang sariling matatag na lipunan at mayamang kultura ang ating mga ninuno. Balikan natin ang pamumuhay ng mga unang Filipino sa aklat na ito, mula sa pagkatuklas nila ng pulo ng Pilipinas hanggang sa iba't ibang sining na nalinang sa panahong ito.[return][return]Ito ay rekomendado sa mga batang edad 12 pataas.",,Ang Unang Barangay by Virgilio S. Almario (2022),Paperback,28 p.; 9 inches,0.22 pounds,9 inches,,7 inches,9 x 7 inches,28,,[2023-12-03],,,65,,,Your library,Tagalog,Tagalog,,[9789715089388],"9789715089388, 9715089380",,,,,1,manual entry,[2023-12-04],,,31338297,(No name),,,
253727191,Wildest Dreams,1,xxAkanexx,,,,Bookware Publishing Corporation,2020,,,"MATURE CONTENT[return][return]Mayaman man at matagumpay sa buhay, nagluluksa si Sandro para sa una niyang pag-ibig na masaya na ngayon sa piling ng ibang lalaki habang siya ay malungkot at nag-iisa sa buhay. Noon naman sumulpot ang isang masayahing babae sa harap niya. Puwede raw siya nitong ibalik sa nakaraan para baguhin ang kanyang buhay.[return]Pumayag si Sandro kahit pa alam niyang may mga consequences ang maliliit na desisyon na gagawin niya sa kanyang pagbabalik sa taong 1991. Ngunit hindi niya inasahan na ganoon pala kalaki ang mga pagbabagong puwedeng mangyari….",,Wildest Dreams by xxAkanexx (2020),Paperback,128 p.; 7.08 inches,,7.08 inches,,,7.08 inches,128,,[2023-12-03],,,66,,Wattpad,Your library,"Tagalog, English",,,[9789714328488],"9789714328488, 9714328489",,,,,1,manual entry,[2023-12-04],,,31338348,(No name),,,
253727431,When I First Met You,1,"Fumah, Jamille",,,,"Anvil Publishing, Inc.",2021,,,"MATURE CONTENT[return][return]You can't hide anything from him...[return]You just can't.[return]Pretty, wealthy, intelligent— that is Embry Maceda, a consistent dean's lister. Nasa ayos ang lahat sa buhay niya, until two storms shattered her frame of mind.[return]First, she got in an accident that damaged her laryngeal nerve. In an instant, she became mute. The second storm came in the form of Cross Gablin Vox, a stunning yet arrogant vampire who could read minds. Nakalolokang kapalaran. Pero mas lalo pang naloka si Embry nang malamang hindi lang pala basta simple thoughts niya ang kayang basahin ni Cross...[return]Because he could also read even her deepest desire.",,When I First Met You by Jamille Fumah (2021),Paperback,,,,,,,221,,[2023-12-03],,,67,,Wattpad,Your library,"Tagalog, English",,,[9789712736742],"9789712736742, 9712736741",,,,,1,manual entry,[2023-12-04],,,31338373,"F, Jenn",Checked out,3/24/2024,4/7/2024
253837381,"Tingnan Mo, O!",1,"Pabiton, Noelle",Author,,,,,,,"Halika, sumilip ka... Ano'ng nakikita mo?[return][return]Come and take a peek... What do you see?[return][return]This large board book for toddlers features die-cuts that make it fun to learn parts of our bodies and what their functions are.",,"Tingnan Mo, O! by Noelle Pabiton",Board book,,,,,,,,,[2023-12-03],,,68,,,Your library,Tagalog,Tagalog,,[9789715087407],"9789715087407, 971508740X",,,,,1,manual entry,[2023-12-06],,,23872578,(No name),,,
253875102,"Saan Ka, Ligaya?",1,"Berron, Karla",Author,"Leizel, Allyana",Illustrator,Buko Books,2022,,,Saan papunta si Ligaya? At sino ang kasama niya? Sama din tayo![return]Where is Ligaya going? And who is she going with? Let's join them!,,Saan papunta si Ligaya? At sino ang kasama niya? Sama din tayo![return]Where is Ligaya going? And who is she going with? Let's join them!,Board book,,,,,,,14,,[2023-12-07],,,69,,"board book, Tagalog, English translation in back, fiction, girl, grandmother, juvenile fiction, grocery shopping",Your library,"Tagalog, English",Tagalog,,[9781739884604],"9781739884604, 1739884604",,,,,1,manual entry,[2023-12-07],,,31355571,"L., Kathleen",Checked out,4/6/2024,5/4/2024
254309093,The Ten-Year Gap,1,"Pornasdoro, Gino",Author,"Lim, Regine",Illustrator,Precious Pages Corporation,2021,,,"Minsan ko nang ibinigay ang tiwala at pagmamahal ko sa isang tao, pero ginamit at sinaktan lang ako. Since that day, I vowed to never let anyone have the chance to hurt me again. [return]But a man named Paulo came.[return]Lahat ng kaya kong pagmamaldita ay ginawa ko sa kanya, but he stayed. He stayed and chose to understand me. And just like how the sun brings warmth after a long winter, natunaw ni Paolo ang yelong matagal nang bumabalot sa puso ko.[return]For the second time, I chose to trust again.[return]I chose to love again, and Paolo loved me, too.[return]Mali man sa paningin ng iba, handa kaming patunayan ang pagmamahalan namin. Everything was already planned out. Magsasama kaming dalawa, tutuparin ang mga pangako sa isa’t isa at bubuo ng masayang pamilya. [return]But destiny decided to interfere.[return]I am Angeline Cruzette Sy. And this is the story of our love…",,The Ten-Year Gap by Gino Pornasdoro (2021),Manga,,,,,,,126,,[2023-12-03],,,70,,"manga, romance, coming-of-age, emotional, roller coaster ride, fiction, absent parents, young love, heartbreak, growing up, made me cry, Wattpad, tragedy, hopeful ending",Your library,"Tagalog, English",Multiple languages,,[9786210308891],"9786210308891, 6210308899",,,,,1,manual entry,[2023-12-16],,,31401055,(No name),,,
254401033,Pamilya Ko,1,"Francisco, Jocelyn",Author,"Ortiz, Jamie",Illustrator,,,,,My family in Filipino,,Pamilya Ko by Jocelyn Francisco,Paperback,,,,,,,,,[2023-12-17],,,71,,"picturebook, family",Your library,"English, Tagalog",,,[9781714468690],"9781714468690, 1714468690",,,,,1,manual entry,[2023-12-18],Kubo LB (Ubefest),,31407814,"BV, Dennis",Checked out,4/6/2024,5/4/2024
254413347,Adventures of Maya: The Lost Fields of Palale,1,"Mondejar-Schlueter, Bernadette",Author,"Loreto, Carlo|Rompal, Ed",Translator|Illustrator,JE Mondejar Book Publishing House,2021,,,Maya and Misauri go on an unexpected adventure to pursue a thief and gets lost in the fields of Palale. Will they be able to recover the stolen item and find their way back to her grandmother’s house?[return][return]The Adventures of Maya: The Lost Fields of Palale is an adventure story for young children that demonstrates the core Filipino value of perseverance and highlights authentic and beloved Waray sweet treats of the region.,,Adventures of Maya: The Lost Fields of Palale by Bernadette Mondejar-Schlueter (2021),Paperback,,,,,,,26,,[2023-12-18],,,72,,"Waray, bilingual, English, picturebook",Your library,"Waray, English",Multiple languages,,[9786219637022],"9786219637022, 621963702X",,,,,1,manual entry,[2023-12-18],,,31408291,(No name),,,
254567660,Maya and Her Loyal Friends,1,"Mondejar-Schlueter, Bernadette",Author,"Rompal, Ed",Illustrator,JE Mondejar Book Publishing House,2020,,,Maya and Her Loyal Friends is the story of a young girl who loves to play with her friends. Things suddenly change when a birthday gift arrives. Will she lose her friends because of this mysterious gift?[return]Maya and Her Loyal Friends is an inspiring story that demonstrates core Filipino values of loyalty and friendship and highlights timeless Waray games that children love.,,Maya and Her Loyal Friends by Bernadette Mondejar-Schlueter (2020),Paperback,,,,,,,21,,[2023-12-20],,,73,,"Waray, picturebook",Your library,"Waray, English",,,[9786219637008],"9786219637008, 6219637003",,,,,1,manual entry,[2023-12-21],,,31423170,"K., Ashley",Checked out,4/6/2024,5/5/2024
254567675,Kiko and the Magical Toothbrush: Si Kiko at ang Mahiwagang Sipilyo,1,"Boomer, Ivy",Author,"Pacliwan, Jason",Illustrator,"Ivy Boomer (2021), 40 pages",2021,,,"A story about a little boy and his adventure with a magical toothbrush.[return]This book is written in English with Filipino (Tagalog) translations.[return][return]Kiko loves to eat sweets.[return]Kiko doesn't love brushing his teeth.[return]Until one night, a magical toothbrush takes him on an adventure.[return]What will Kiko do when he discovers what's going on inside his mouth?[return][return]Mahilig kumain ng matamis si Kiko.[return]Ayaw ni Kiko na magsipilyo.[return]Hanggang sa isang gabi, isang mahiwagang sipilyo ang nagdala sa kanya sa isang pakikipagsapalaran.[return]Ano ang gagawin ni Kiko kapag nadiskubre niya ang nangyayari sa loob ng kanyang bibig?",,Kiko and the Magical Toothbrush: Si Kiko at ang Mahiwagang Sipilyo by Ivy Boomer (2021),Hardcover,40 p.; 8.5 inches,0.72091159674 pounds,8.5 inches,0.25 inches,8.5 inches,8.5 x 8.5 x 0.25 inches,40,,,,,74,,,Your library,"Tagalog, English",,,[9780645162837],"9780645162837, 0645162833",,,,,1,amazon.com books,[2023-12-21],,,31423172,(No name),,,
254608266,Ang mga Lambing ni Lolo Ding,1,"M. Coroza, Michael",Author,"Risulmi, Maurice",Illustrator,"Adarna House, Inc.",2018,,,"Ang mga lambing ni Lolo Ding ay mga butil ng pagpapakabuti. [return]Kahit hindi na siya katabi, kahit hindi na siya kapiling, laging nagugunita ang kaniyang mga lambing. Nagsisilbing tanglaw ang mga ito, tulad ng mga bituin.[return]Ito ay rekomendado sa mga batang edad 10 pataas.[return]Lolo Ding’s endearments are seeds of character. Even if he is no longer with us, his endearments will always be remembered. These will serve as beacons, like stars in the night sky.",,Ang mga Lambing ni Lolo Ding by Michael M. Coroza (2018),Paperback,32 p.; 9 inches,0.22 pounds,9 inches,,7 inches,9 x 7 inches,32,,[2023-12-03],,,75,,"picturebook, bilingual, Tagalog, English, loss, grieving, lolo",Your library,"Tagalog, English",Multiple languages,,[9789715084215],"9789715084215, 9715084214",,899.21134,"Literature > Literature of other languages > Malay and Austronesian languages > Other Literature: Pacific Islands, Basque, Artificial Languages, Georgia, Mesopotamia   > Philippine languages > Tagalog (Filipino) > Tagalog fiction",,1,manual entry,[2023-12-22],,,20928773,(No name),,,
254837663,"Lo Pahinging Piso (Lolo, Can I Have A Peso)",4,"Menina, Ladie Mae",Author,"Menina, Krist",Illustrator,"Kado Publishing (2022), 29 pages",2022,,,"Lo Pahinging Piso is a touching story about a young girl, her Lolo, and her journey toward learning to love the simple blessings in life.[return]The book is written bilingually in Filipino and English, with Hiligaynon vocabulary words, and a Glossary to teach young readers about the Hiligaynon words and cultural anecdotes in the story.",,"Lo Pahinging Piso (Lolo, Can I Have A Peso) by Ladie Mae Menina (2022)",Paperback,29 p.; 11 inches,,11 inches,0.07 inches,8.5 inches,11 x 8.5 x 0.07 inches,29,,,,,76,,,Your library,"Hiligaynon, English",,,[9786214670260],"9786214670260, 6214670266",,,,,1,amazon.com books,[2023-12-27],,,31442753,(No name),,,
254837771,A Mask of My Own: Ang Akon Maskara,3,"Yao, Ines Bautista",Author,"Camus, Georgina",Illustrator,"Kado Publishing (2022), 24 pages",2022,,,It's time for the annual Negros Occidental Masskara Festival and little Carmela wants to make her own mask. But what will she draw on it? There are just too many things she loves about living in Negros! Find out what they are and how Carmela's mask will look!,,A Mask of My Own: Ang Akon Maskara by Ines Bautista Yao (2022),Paperback,24 p.; 10 inches,,10 inches,0.06 inches,7 inches,10 x 7 x 0.06 inches,24,,,,,77,,,Your library,Hiligaynon,English,,[9786214670291],"9786214670291, 6214670290",,,,,1,amazon.com books,[2023-12-27],,,30362815,"Cyndi T, Child of",Checked out,4/7/2024,5/5/2024
254929252,Diin ya Kuti: A Kinaray-a Word & Picture Book,1,"Taguiwalo, Beaulah P.",Author,"Taguiwalo, Beaulah P.|Benedicto, Eileen Grace P.",Illustrator|Author,CreateSpace Independent Publishing Platform,2014,,,"Originally written in Hiligaynon then translated to English and other languages.[return][return]References: The online dictionaries at www.bohol.ph, Kaufmann's Visayan-English Dictionary (KVED), Wolff's Cebuano English Dictionary, Google Translate, and native speaker colleagues in various languages.[return][return]Contact Information[return]Blog: bookswithoutborders.wordpress.com[return]Email: bookswithoutborders@gmail.com[return]Facebook: Eileen Grace P. Benedicto",,Diin ya Kuti: A Kinaray-a Word & Picture Book by Beaulah P. Taguiwalo (2014),Paperback,32 p.; 11.02 inches,0.23 pounds,11.02 inches,0.07 inches,8.5 inches,11.02 x 8.5 x 0.07 inches,32,,[2023-12-24],,,78,,Kinaray-a,Your library,Philippine (Other),Hiligaynon,,[9781494934705],"9781494934705, 1494934701",,,,,1,amazon.com books,[2023-12-28],,,31449407,(No name),,,
