Book Id,Title,Sort Character,Primary Author,Primary Author Role,Secondary Author,Secondary Author Roles,Publication,Date,Review,Rating,Comment,Private Comment,Summary,Media,Physical Description,Weight,Height,Thickness,Length,Dimensions,Page Count,LCCN,Acquired,Date Started,Date Read,Barcode,BCID,Tags,Collections,Languages,Original Languages,LC Classification,ISBN,ISBNs,Subjects,Dewey Decimal,Dewey Wording,Other Call Number,Copies,Source,Entry Date,From Where,OCLC,Work id,Lending Patron,Lending Status,Lending Start,Lending End
255745521,Awesome Filipino Child Discoveries: My First Alphabet Book of Filipino Words,1,"Credito, Norwin",Author,,,"CreateSpace Independent Publishing Platform (2017), 26 pages",2017,,,"This book introduces Filipino words for toddlers and preschool children. It is suitable for Filipino kids who live in an English foreign country. Each page has a Filipino alphabet with illustrations, that are translated in to Tagalog and English as they learn two languages at the same time. Your kids will enjoy reading and learning from this awesome activity book. The little ones should be guided by Parents to read and say each word in Tagalog and English. If you are looking for Filipino children's books, you're in the right place! Our Filipino Child Discoveries series contains the most comprehensive Filipino books for children and are the best Tagalog learning books available. What makes our books the best Filipino books for kids? Each of our Tagalog kids books contain both English and Tagalog, as well as superb graphics that presents the learning material in an easy to understand manner. You'll love all of our Tagalog ebooks and Tagalog books, all of which are available here on Amazon. Go ahead and help your little one to memorize Awesome Filipino Child Discoveries: “My First Alphabet Book of Filipino Words”.",,Awesome Filipino Child Discoveries: My First Alphabet Book of Filipino Words by Norwin Credito (2017),Paperback,26 p.; 8 inches,0.17 pounds,8 inches,0.07 inches,5.25 inches,8 x 5.25 x 0.07 inches,26,,[2024-01-07],,,79,,,Your library,"Tagalog, English",,,[9781548097479],"9781548097479, 1548097470",,,,,1,amazon.com books,[2024-01-08],,,31503741,(No name),,,
255745889,"The Toddler's Handbook: Bilingual (English / Filipino) (Ingles / Filipino) Numbers, Colors, Shapes, Sizes, ABC Animals, Opposites, and Sounds, with ... Learning Books (English and Filipino Edition)",1,"Martin, Dayna",Author,"Roumanis, A R",Editor,"Engage Books (2017), Edition: Large type / Large print, 48 pages",2017,,,"The Toddler's Handbook introduces 17 basic concepts in English and Filipino. Included are numbers, colors, shapes, sizes, ABCs, animals, opposites, sounds, actions, sports, food, tableware, clothes, engines, emotions, body, and time. This book develops early language skills using 174 words that every kid should know. Vibrant colors and images are designed to attract the attention of babies and toddlers. This book will help children learn a variety of important concepts in English and Filipino before preschool.",,"The Toddler's Handbook: Bilingual (English / Filipino) (Ingles / Filipino) Numbers, Colors, Shapes, Sizes, ABC Animals, Opposites, and Sounds, with ... Learning Books (English and Filipino Edition) by Dayna Martin (2017)",Paperback,48 p.; 8.5 inches,0.31746565728 pounds,8.5 inches,0.13 inches,8.5 inches,8.5 x 8.5 x 0.13 inches,48,,[2024-01-07],,,80,,,Your library,"Tagalog, English",German,LB1050.44 .M378,[9781772264333],"9781772264333, 1772264334",,491.4281,East Indo-European and Celtic languages > Language > Modern East Indian languages (excluding Dravidian) > Other Languages > Punjabi > School books; Texts for learning the language > Spelling books,,1,amazon.com books,[2024-01-08],,,20792282,(No name),,,
256151631,The Fabulous Lost & Found and the Little Mouse Who Spoke Tagalog,1,"Pallis, Mark",Author,"Boynton, Peter",Illustrator,NeuWestendPress.com,2020,,,"A little mouse walks into the Lost & Found, but can only speak Tagalog. How will Mr and Mrs Frog figure out what the mouse is missing…?",,The Fabulous Lost & Found and the Little Mouse Who Spoke Tagalog by Mark Pallis (2020),Paperback,36 p.; 8.5 inches,0.24 pounds,8.5 inches,,8.5 inches,8.5 x 8.5 inches,36,,[2024-01-06],,,81,,"picturebook, Tagalog, English, bilingual",Your library,"English, Tagalog",,,[9781916080188],"9781916080188, 1916080189",,,,,1,manual entry,[2024-01-14],Aunt Katy,,28390961,"K., Ashley",Checked out,4/6/2024,5/5/2024
256405082,Ako Ay May Lobo,1,"Go, Tippy",Illustrator,,,"Adarna House, Inc.",2022,,,Kabilang sa seryeng nagtatampok ng mga awiting kagigiliwan ng mga bata.,,Ako Ay May Lobo by Tippy Go (2022),Board book,10 p.; 5.12 inches,0.24 pounds,5.12 inches,,5.12 inches,5.12 x 5.12 inches,10,,[2024-01-17],,,82,,"board book, song, Adarna House Inc.",Your library,Tagalog,Tagalog,,[9789715088596],"9789715088596, 9715088597",,,,,1,manual entry,[2024-01-17],Hot Tropiks,,31552670,(No name),,,
256405202,Hati Tayo,1,"Molina, Russell",Author,"Agsaway, Dominic",Illustrator,"Adarna House, Inc.",2022,,,Hati tayo![return]Isang piraso. Dalawa ang busog.[return]Kabilang ang munting aklat na ito sa seryeng nagtuturo ng kabutihang-asal.,,Hati Tayo by Russell Molina (2022),Board book,14 p.; 5.12 inches,0.24 pounds,5.12 inches,,5.12 inches,5.12 x 5.12 inches,14,,[2024-01-17],,,83,,"board book, Adarna House Inc.",Your library,Tagalog,Tagalog,,[9780715089289],9780715089289,,,,,1,manual entry,[2024-01-17],Hot Tropiks,,31552681,(No name),,,
256406312,Thirsty,1,"Herras, Paolo",Editor,"Mercado, Richard",Editor,Komiket,2022,,,"Love Boys[return]Who Love Boys[return]Who Love Boys?[return]From the hopelessly romantic schoolboy crushes to the hot and steamy fantasy of your dreams—we're serving fifteen thirst-quenching stories in this Filipino boys love anthology. [return]There's a lot of boys to love, [return]SO STAY THIRSTY.",,Thirsty by Paolo Herras (2022),Comic book,253 p.; 9 inches,,9 inches,,6 inches,9 x 6 inches,253,,[2024-01-17],,,84,,"comic, graphic novel, mature content, Komiket",Your library,"English, Tagalog",Multiple languages,,[9786218244276],"9786218244276, 621824427X",,,,,1,manual entry,[2024-01-17],Hot Tropiks,,31552781,(No name),,,
256408795,Tarantadong Kalbo 1,1,"Eric Raymundo, Kevin",Author,"Eric Raymundo, Kevin",Illustrator,Komiket,2020,,,"Mula sa pagtapal ng repolyo hanggang paglamon ng dolomite, ito ang koleksyon ng mga komiks ni Tarantadong Kalbo sa taong 2020, ang pinakamasagwang taon nating lahat.",,Tarantadong Kalbo 1 by Kevin Eric Raymundo (2020),Comic book,191 p.; 7.25 inches,,7.25 inches,,6 inches,7.25 x 6 inches,191,,[2024-01-17],,,85,,"comic, National Book Awards winner, TK",Your library,"Tagalog, English",Multiple languages,,[9786218244009],"9786218244009, 6218244008",,,,,1,manual entry,[2024-01-17],Hot Tropiks,,26145938,(No name),,,
256459555,Tarantadong Kalbo 2,1,"Eric Raymundo, Kevin",Author,,,Komiket,2021,,,"Nagkagulo sa bakuna, nag-agawan ng itlog, nagkanaw ng dalgona, nagmahalan ang mga baboy, naghabulan ng jetski, nagtulungan sa mga pantry, at tumindig para sa bayan. Ito ang koleksyon ng mga komiks ni Tarantadong Kalbo sa unang parte ng 2021, ang sequel sa pinakamasagwang taon nating lahat.",,Tarantadong Kalbo 2 by Kevin Eric Raymundo (2021),Comic book,204 p.; 7 inches,,7 inches,,6 inches,7 x 6 inches,204,,[2024-01-17],,,86,,"comic, humor",Your library,"Tagalog, English",Multiple languages,,[9786218244047],"9786218244047, 6218244040",,,,,1,manual entry,[2024-01-18],Hot Tropiks,,30939285,(No name),,,
256459815,Tarantadong Kalbo 3,1,"Eric Raymundo, Kevin",,,,Komiket,2022,,,"Nagsilabasan ang mga payaso at hunyango, dahil election season na! Ito ang koleksyon ng mga komiks ni Tarantadong Kalbo sa taong 2022, ang bubuo sa trilogy ng kabadtripan.",,Tarantadong Kalbo 3 by Kevin Eric Raymundo (2022),Comic book,206 p.; 7 inches,,7 inches,,6 inches,7 x 6 inches,206,,[2024-01-17],,,87,,"comic, humor, Komiket",Your library,"Tagalog, English",Multiple languages,,[9786218244177],"9786218244177, 6218244172",,,,,1,manual entry,[2024-01-18],Hot Tropiks,,30939289,"F, Jenn",Checked out,3/24/2024,4/7/2024
256460244,Darkness,1,"Herras, Paolo",Editor,,,Komiket,2022,,,"Whether it comes in the form of a malevolent spirit, or a terrifying beast, these shadows reveal the darkness within us, reflections of our own fears, anger, or shame.[return]This anthology explores the darkness that these creators choose to battle - the black fog, that envelopes and cripples, the dark room without a key, and the hole that gets deeper and deeper with no way out.[return]But despite all these horrifying scenarios, the darkness has a very important purpose - it's only in the darkness nights do we find the light within - the wisdom of a solution to a problem, the strength to face and conquer real-life monsters, and the courage to slay our inner demons to reveal a better version of our selves. For the darkest darkness can never exist without the brilliance of light.",,Darkness by Paolo Herras (2022),Comic book,222 p.; 9 inches,,9 inches,,6 inches,9 x 6 inches,222,,[2024-01-17],,,88,,"comic, compilation, bilingual, Tagalog, English",Your library,"Tagalog, English",Multiple languages,,[9786218244238],"9786218244238, 6218244237",,,,,1,manual entry,[2024-01-18],,,31557838,(No name),,,
256460895,Duty Ka Ba? Komiks,1,"Pascual, Tepai",Author,,,19th Avenida Publishing House,2022,,,"Hahanap na lang ako ng cardiologist para alagaan niya ang puso ko. [return]Pero, hala, pagkakita mo pa lang sa kanya, tumaas na ang heart rate mo, nag-init ang mukha na parang lalagnatin sa kilig. Paglapat ng stethoscope sa dibdib mo, biglang lumapad ang blood vessels sa pisngi mo. Ang capillaries mo, oh no! Namumula ka, mars, mukha kang kamatis! [return]Gising, nasa check-up ka pa lang, girl! Imagination mo lang 'yan. Or is it? [return]Marupok! Maharot! Malandi! [return]Ito ang mga kuwento ng hindi mapigilang mga hugot mula sa kaibuturan ng hypothalamus gland.",,Duty Ka Ba? Komiks by Tepai Pascual (2022),Comic book,211 p.; 9 inches,,9 inches,,6 inches,9 x 6 inches,211,,[2024-01-17],,,89,,"comic, Avenida, nurses, humor, 4-koma",Your library,"Tagalog, English",Multiple languages,,[9786218264144],"9786218264144, 6218264149",,,,,1,manual entry,[2024-01-18],Hot Tropiks,,31557850,(No name),,,
256461297,"Twinkle, Twinkle",1,"Tadiar, Tori",Author,"Yap, Sharlene",Contributor,Komiket,2021,,,"MANILA: THE GOLDEN AGE. [return]The city glitters at night: tranvias run up and down wide streets, arcades and hotels are swarmed with celebrities, and theaters attract droves to see stars perform on the silver screen and onstage. [return]Twins Alta and Signa work at the theaters until dawn, day in and day out. It's a grind until the next starfall, when they break their routine and use a magical ability to see and catch falling stars, hoping to sell the stardust off to a mysterious patron. But when up-and-coming singer Hanan is catapulted into stardom, the twins are pulled into the orbit of Manila's star-studded nightlife and discover that catching falling stars is a lot more than they bargained for.",,"Twinkle, Twinkle by Tori Tadiar (2021)",Comic book,124 p.; 9 inches,,9 inches,,6 inches,9 x 6 inches,124,,[2024-01-17],,,90,,"comic, English",Your library,English,English,,[9786219564199],"9786219564199, 6219564197",,,,,1,manual entry,[2024-01-18],,,28698128,(No name),Available @ Jamba (Old Pasadena),4/21/2024,
256461629,Ang Jowa Kong Crosswise,1,Tsambolero,Author,,,Penlab Sprint,2022,,,"The half of it...[return]And then some.[return]Follow the life and times of Tomas and Leo, who are, for all intents and purposes, an unremarkably average couple in their mid-twenties... or so it would seem. Tomas is actually a self-segmenting winged creature of the night, while Leo is, well, just Leo. [return]Take an intimate peek into the mundanities of their relationship, and find out just how exciting interracial domesticity could be in this Ang Jowa Kong Crosswise double digest.",,Ang Jowa Kong Crosswise by Tsambolero (2022),Comic book,193 p.; 8.25 inches,,8.25 inches,,5.75 inches,8.25 x 5.75 inches,193,,[2024-01-17],,,91,,"comic, interracial, Tagalog, English, Taglish, bilingual, BL, romance, fantasy",Your library,"Tagalog, English",Multiple languages,,[9798987911044],9798987911044,,,,,1,manual entry,[2024-01-18],Hot Tropiks,,31557886,(No name),,,
256461783,Spirit Sprints Book 1,1,"Mercado, Bernie",Editor,"Mercado, Bernie|Torralba, Nina|Dimapilis, Hansel",Author|Author|Illustrator,Penlab Sprint,2023,,,"Bugkang naglayag na, [return]Pilit nagsasagwan pabalik.[return]Bugtong-bugtong is folk magic that summons the spirits of all things, which allows souls to find their final resting place. Shamans use this magic to pacify storms and protect our lands, and Rara Balete is the very last descendant to inherit it. [return]However, unable to accept that those she loves have passed on, Rara refuses to believe her ancestry. But after meeting a cat who takes her to the world of stray spirits, Rara has no choice but to face her role as a shaman.[return]As she goes through a journey of self-discovery, Rara remembers her grandmother's words: That she has to find the one companion spirit bonded to her.[return]Her kasama.",,Spirit Sprints Book 1 by Bernie Mercado (2023),Comic book,184 p.; 8.25 inches,,8.25 inches,,6 inches,8.25 x 6 inches,184,,[2024-01-17],,,92,,"comic, Tagalog",Your library,Tagalog,Tagalog,,[9798987911013],9798987911013,,,,,1,manual entry,[2024-01-18],Hot Tropiks,,31557897,(No name),,,
256525403,Katipunera Warrior Storming Flow,1,"Mercado, Bernie",Author,"Torralba, Nina|Torralba, Nina|Dimapilis, Hansel|Sampay",Author|Translator|Letters|Illustrator,Penlab Sprint,2023,,,"Tabi tabi po. Ancestors, allow us safe passage.[return]In a re-imagined colonial Philippines, demonic apes said to be offsprings of our colonizers and our native ancestors roam our lands. A child, born from both, is branded as a demon child and cast out by the barrio folk to the birthplace of these demons they call bakulaw. [return]After the child meets the bakulaw progeny of an ancestor, a sleeping ancestral curse awakens, threatening the destruction of her barrio. To stop it, she must become a Makatao, a spirit warrior who has become one with their forest spirit ancestor.[return]This is the story of Andrea, a child whose ancestors are both the colonizers and the colonized, and how she comes into her own passing through a world held back by generational curses.",,Katipunera Warrior Storming Flow by Bernie Mercado (2023),Comic book,192 p.; 8.25 inches,,8.25 inches,,5.75 inches,8.25 x 5.75 inches,192,,[2024-01-17],,,93,,"comic, English, Penlab",Your library,English,,,[979987911068],979987911068,,,,,1,manual entry,[2024-01-19],Hot Tropiks,,31559517,(No name),,,
256525879,Ang Kagila-Gilalas Na Pakikipagsapalaran Ni Zsazsa Zaturnnah,1,"Vergara, Carlo",Creator,,,19th Avenida Publishing House,2023,,,"Huwag mo nang itanong kung bakit...[return]A mysterious stone falls from the heavens, granting Ada the ability to transform into Zaturnnah, a superhuman warrior endowed with uncanny strength and remarkable beauty. As Zaturnnah, Ada defends a small town from rampaging zombies, power-tripping extraterrestrial amazons, and… well, you know the drill.  [return]Adding color to this simple but riotous tale is the fact that Ada is a homosexual, proprietor of his own quaint beauty salon. With his frilly-mouthed assistant Didi and his objet d’amour Dodong, Ada reinforces his belief in acknowledging the decisions of destiny, and begins to explore the potential fullness of life.",,Ang Kagila-Gilalas Na Pakikipagsapalaran Ni Zsazsa Zaturnnah by Carlo Vergara (2023),Comic book,158 p.; 10 inches,,10 inches,,7 inches,10 x 7 inches,158,,[2024-01-17],,,94,,"comic, mature content, Tagalog",Your library,Tagalog,Tagalog,PN6790 P64 Z73,[9786218264182],"9786218264182, 6218264181",,741.5959,"Asian > Cartoons, Caricatures, Comics > Collections > Drawing &  drawings > Graphic arts and decorative arts > Southeast Asian > The arts",,1,manual entry,[2024-01-19],Hot Tropiks,,432314,(No name),,,
256526038,Zsazsa Zaturnnah sa Kalakhang Maynila,1,"Vergara, Carlo",Creator,,,19th Avenida Publishing House,2022,,,"Aling pag-ibig pa ang hihigit kaya?[return]After defeating a giant frog, a horde of zombies, and the extraterrestrial Amazonistas, small-town beautician Ada begins a new chapter by moving to the big city with hunky Dodong, and taking up residence in the old house of his friend Gwyneth. Not only does earning his keep prove more difficult, Ada also finds himself dealing with a haunting past, the return of the Zaturnnah stone, new enemies and allies, startling revelations, true confessions, and the prospect of a new—and complicated—romance. Can Ada survive a place that seeks to wear out his mind, his body, and his heart?",,Zsazsa Zaturnnah sa Kalakhang Maynila by Carlo Vergara (2022),Comic book,286 p.; 10 inches,,10 inches,,7 inches,10 x 7 inches,286,,[2024-01-17],,,95,,"comic, mature content, Tagalog",Your library,Tagalog,Tagalog,PN6790.P53 V479,[9786218264137],"9786218264137, 6218264130",,,,,1,manual entry,[2024-01-19],Hot Tropiks,,12306309,(No name),,,
256526201,Dead Balagtas Mga Sayaw ng Dagat at Lupa,1,"Kampilan, Emiliana",Creator,,,Anino Comics,2019,,,"Ang Dead Balagtas ang una at pinakamalikhaing komiks tungkol sa mahaba at makulay na kasaysayan ng Filipinas.   [return]Sa unang tomong ito, isasalaysay ng isang maalam na babaylan ang pagsilang ng santinakpan mula sa mainit na pagmamahalan ni Tungkung Langit at Laon Sina. Saksihan ang pagbangon ng mga kontinente, ang banggaan ng mga karagatan, ang pag-iibigan ng dagat at lupa—mga puwersang bumuo at patuloy na humuhulma sa ating tahanan at bayan, ang Filipinas.",,Dead Balagtas Mga Sayaw ng Dagat at Lupa by Emiliana Kampilan (2019),Comic book,124 p.; 12 x 8 inches,,8 inches,,12 inches,8 x 12 inches,124,,[2024-01-17],,,96,,"comic, 16+, Tagalog",Your library,Tagalog,Tagalog,DS664 .K36,[9789715087186],"9789715087186, 9715087183",,,,,1,manual entry,[2024-01-19],Hot Tropiks,,22960762,(No name),,,
257267745,Sixty Six,1,"Molina, Russell",,,,,,,,"The story of Celestino Cabal. His birthday has just passed. He received a gift that he now gets to open, bit by bit. As the old saying goes, “Better late than never.”[return][return]Kuwento ni Celestino Cabal. Kabebertdey niya lang. Mayroon siyang natanggap na regalo na ngayo’y unti-unti niyang binubuksan. Ika nga ng matatanda, “Huli man daw at magaling, maihahabol din.”",,Sixty Six by Russell Molina,Comic book,,,,,,,,,,,,97,,"comic, Tagalog",Your library,Tagalog,Tagalog,,[9789715085601],"9789715085601, 9715085601",,899.21134,"Literature > Literature of other languages > Malay and Austronesian languages > Other Literature: Pacific Islands, Basque, Artificial Languages, Georgia, Mesopotamia   > Philippine languages > Tagalog (Filipino) > Tagalog fiction",,1,manual entry,[2024-01-28],,,23408398,(No name),,,
257276305,Ang Bangin Sa Ilalim ng Ating Mga Paa,1,"Vivo Jr., Ronaldo",Author,,,,,,,"Agad na kinontak ni Reynold ‘‘Rey’’ Ventura, isang hardware owner, ang mga kaibigan ng anak niyang si Alison, isang gabing hindi ito umuwi. Pero lahat sila, walang ideya kung saan ito naroon.[return][return]Mula sa isang unsent message ng anak sa Facebook Messenger, sisimulang pagtagpi-tagpiin ni Rey ang mga pangyayari. Sa tulong ng matalik na kaibigang si Benjo, isang ‘‘BPO Yakuza’’ kung tagurian, tutuntunin nila ang kinaroroonan ni Alison. Sa biyaheng ito, matutuklasan nila ang tunay na silbi ng martilyo.",,Ang Bangin Sa Ilalim ng Ating Mga Paa by Ronaldo Vivo Jr.,Paperback,228 p.; 8.5 inches,,8.5 inches,,5.5 inches,8.5 x 5.5 inches,228,,,,,98,,"Tagalog, mature content",Your library,Tagalog,Tagalog,,[9786218264175],"9786218264175, 6218264173",,,,,1,manual entry,[2024-01-29],,,31613713,(No name),,,
257293030,The Filipino Child (Ang Batang Pinoy): Healthy and Respectful /Malusog at Magalang,1,"Suzara-Cheng, Jennifer",Author,"Basbas, Fer",Illustrator,"Www.Filam-Ecograndma.com (2023), 26 pages",2023,,,"This book, Ang Batang Pinoy (The Filipino Child), is dedicated to the children of Filipino descendants all over the world. It revolves around the traits that she has experienced while growing up in the Philippines. More importantly, she invites all the parents, grandparents and extended families to serve as the bridge in passing along our language and culture to the next generation.[return][return][return][return]""Ang hindi marunong[return][return]magmahal sa sariling wika[return][return]ay higit pa sa hayop at[return][return]malansang isda""[return][return][return][return]He who does not love his[return][return]own language is worse[return][return]than an animal and smelly fish[return][return]-Dr. JOSE RIZAL[return][return]Purchased at https://www.filam-ecograndma.com/",,The Filipino Child (Ang Batang Pinoy): Healthy and Respectful /Malusog at Magalang by Jennifer Suzara-Cheng (2023),Paperback,26 p.; 9 inches,0.13 pounds,9 inches,0.07 inches,6 inches,9 x 6 x 0.07 inches,26,,,,,99,,,Your library,English,English,,[9798989047000],9798989047000,,,,,1,amazon.com books,[2024-01-29],,,31309133,(No name),Available @ Jamba (Old Pasadena),4/21/2024,
257313469,Dear America: Young Readers’ Edition: The Story of an Undocumented Citizen,1,"Vargas, Jose Antonio",Author,,,HarperCollins,2020,,,"Jose Antonio Vargas was only twelve years old when he was brought to the United States from the Philippines to live with his grandparents. He didn’t know it, but he was sent to the U.S. illegally.[return][return]When he applied for a learner’s permit, he learned the truth, and he spent the next almost twenty years keeping his immigration status a secret. Hiding in plain sight, he was writing for some of the most prestigious news organizations in the country. Only after publicly admitting his undocumented status—risking his career and personal safety—was Vargas able to live his truth.[return][return]This book asks questions including, How do you define who is an American? How do we decide who gets to be a citizen? What happens to those who enter the U.S. without documentation?[return][return]By telling his personal story and presenting facts without easy answers, Jose Antonio Vargas sheds light on an issue that couldn’t be more relevant.",,Dear America: Young Readers’ Edition: The Story of an Undocumented Citizen by Jose Antonio Vargas (2020),Paperback,144 p.; 7.62 inches,0.22 pounds,7.62 inches,0.29 inches,5.12 inches,7.62 x 5.12 x 0.29 inches,144,,,,,100,,,Your library,English,English,PN4874.V37 A3,[9780062914590],"9780062914590, 0062914596",,304.8,Factors affecting social behavior > Movement of people > Social Sciences; Sociology and anthropology > Social sciences,,1,amazon.com books,[2024-01-29],,,22686287,(No name),Available @ Jamba (Old Pasadena),4/21/2024,
257313956,Doobiedoo Asks,1,Eloriaga-Amago Bambi,Author,,,,,,,"What do you call it when two spiders get married? A WEBBING![return]Doobiedoo Asks funny (and pun-ny!) questions. One day, he asks Mom and Dad a rather unusual one: “What is wrong with me?” Determined to help Doobie out, they discover he is on the autism spectrum. But how can first-time parents overcome unexpected challenges to help their son gain the confidence to succeed in school, and go back to being the happy pun-ny boy everyone loves?",,Doobiedoo Asks by Eloriaga-Amago Bambi,Comic book,,,,,,,112,,,,,101,,"comic, English",Your library,English,,,[9786219564168],"9786219564168, 6219564162",,,,,1,manual entry,[2024-01-29],,,28698132,"K., Ashley",Checked out,4/6/2024,5/5/2024
257314256,Bahay-kubo,1,"Acuña, Pergylene",,,,"Quezon City, Philippines : Adarna House, [2012]",2012,,,"This well-loved Filipino song has been put to print a number of times over the past years. What makes this particular edition unique is that it is made especially for young children – the format and the method in which it is illustrated appeals to the very audience that the song is taught to.[return][return]Bahay Kubo by Adarna House is the kind of book that can grow with a child. Its whimsical illustrations invite young readers to explore every page and, through each line and phrase, helps plant the seeds of our culture in the young minds of today.",,Bahay kubo by Pergylene Acuña (2012),Paper Book,13 cm,,13 cm,,,13 cm,,,,,,102,,,Your library,Tagalog,,,[9789715084093],"9789715084093, 9715084095",Vegetables Children's picture books,FILIPINO jBOARD,,,1,"San Francisco Public Library (San Francisco, CA)",[2024-01-29],,,19844467,"L., Kathleen",Checked out,4/6/2024,5/4/2024
257316048,"Saan ka, Ligaya?",1,"Berron, Karla",Author,,,,,,,Saan papunta si Ligaya? At sino ang kasama niya? Sama din tayo![return]Where is Ligaya going? And who is she going with? Let's join them!,,"Saan ka, Ligaya? by Karla Berron",Board book,,,,,,,,,,,,103,,"board book, Tagalog, English translation in back",Your library,"Tagalog, English",,,[9781739884604],"9781739884604, 1739884604",,,,,1,manual entry,[2024-01-29],,,31355571,"L., Louis",Checked out,4/6/2024,5/5/2024
257316097,A is for Adobo: ABCs of Filipino Culture,3,"Reyes, G.M.",Author,"A, Twinkle",Illustrator,"Independently published (2022), 62 pages",2022,,,"A rhyming ABC book that takes you on a journey through Filipino food, landmarks, and items. Visit B as in Boracay, eat L as in Lumpia, and ride a J as in Jeepney in this fun, educational book for Filipino children, or for anyone who wants to learn more about Filipino culture!",,A is for Adobo: ABCs of Filipino Culture by G.M. Reyes (2022),Paperback,62 p.; 10 inches,0.4299014109 pounds,10 inches,0.15 inches,8 inches,10 x 8 x 0.15 inches,62,,,,,104,,,Your library,English,English,,[9798362510480],9798362510480,,,,,1,amazon.com books,[2024-01-29],,,30938879,"V, Darren",Checked out,3/10/2024,3/24/2024
