Book Id,Title,Sort Character,Primary Author,Primary Author Role,Secondary Author,Secondary Author Roles,Publication,Date,Review,Rating,Comment,Private Comment,Summary,Media,Physical Description,Weight,Height,Thickness,Length,Dimensions,Page Count,LCCN,Acquired,Date Started,Date Read,Barcode,BCID,Tags,Collections,Languages,Original Languages,LC Classification,ISBN,ISBNs,Subjects,Dewey Decimal,Dewey Wording,Other Call Number,Copies,Source,Entry Date,From Where,OCLC,Work id,Lending Patron,Lending Status,Lending Start,Lending End
253424893,The Filipino Child (Ang Batang Pinoy): Healthy and Respectful /Malusog at Magalang,1,"Suzara-Cheng, Jennifer",Author,"Basbas, Fer",Illustrator,"Www.Filam-Ecograndma.com (2023), 26 pages",2023,,,"This book, Ang Batang Pinoy (The Filipino Child), is dedicated to the children of Filipino descendants all over the world. It revolves around the traits that she has experienced while growing up in the Philippines. More importantly, she invites all the parents, grandparents and extended families to serve as the bridge in passing along our language and culture to the next generation.[return][return][return][return]""Ang hindi marunong[return][return]magmahal sa sariling wika[return][return]ay higit pa sa hayop at[return][return]malansang isda""[return][return][return][return]He who does not love his[return][return]own language is worse[return][return]than an animal and smelly fish[return][return]-Dr. JOSE RIZAL[return][return]Purchased at https://www.filam-ecograndma.com/",,The Filipino Child (Ang Batang Pinoy): Healthy and Respectful /Malusog at Magalang by Jennifer Suzara-Cheng (2023),Paperback,26 p.; 9 inches,0.13 pounds,9 inches,0.07 inches,6 inches,9 x 6 x 0.07 inches,26,,,,,1,,,Your library,"Tagalog, English",,,[9798989047000],9798989047000,,,,,1,amazon.com books,[2023-11-28],,,31309133,"K., Ashley",Checked out,4/6/2024,5/5/2024
253428023,Nasaan Si Kris?,1,"Villanueva, Rene",Author,,,Anvil Publishing Inc. (2019),2019,,,Kakain na pero nawawala si Kris! Hinahanap siya ng kaniyang ina. Nasa loob kaya siya ng orasan? O nasa ilalim ng hagdan? Alamin kung saan nagtatago si Kris sa iba’t ibang bahagi ng bahay![return]It’s time to eat and Kris is nowhere to be found! Kris’s mom is looking for her. Could she be inside the clock? Is she under the stairs? Look through the different parts of the house to find out where Kris is hiding!,,Nasaan Si Kris? by Rene Villanueva (2019),Board book,17 cm,,17 cm,,,17 cm,,,,,,2,,,"Your library, Board Books, Si Kris","Tagalog, English",Tagalog,,[978-971-27-3548-6],"978-971-27-3548-6, 9712735486, 9789712735486",,,,,1,Bowker Books in Print,[2023-11-28],,,31309330,"R., Jett",Checked out,4/6/2024,5/5/2024
253428030,Alam ni Kris ang Magkakasalungat na Salita,1,"Villanueva, Rene",Author,"de Dios Ballecer, Katrina",Illustrator,Anvil Publishing Inc.,2019,,,"Gustong-gusto ni Kris na matulog sa ilalim ng upuan, pero minsan, gusto rin niyang matulog sa ibabaw nito. Minsan, puno ang mangkok niya, ngunit minsan, wala itong laman! Sa bilingguwal na seryeng ito na para sa mga nakababatang mag-aaral, pagyayamin ang kanilang bokabularyo sa pagkatuto ng mga salitang magkakasalungat ang kahulugan. [return][return]Kris loves to sleep under the chair, but, sometimes, Kris loves to sleep on the chair. Sometimes, Kris's bowl is full, but sometimes it's empty! In this bilingual series for early learners, kids will enrich their growing vocabulary by learning about opposites.",,Alam ni Kris ang Magkakasalungat na Salita by Rene Villanueva (2019),Board book,16 p.; 6.5 inches,0.36 pounds,6.5 inches,,6.5 inches,6.5 x 6.5 inches,16,,,,,3,,"board book, bilingual, anvil starters, fiction, polarity, opposites, cat","Your library, Board Books, Si Kris","Tagalog, English",Multiple languages,,[9789712735479],"9789712735479, 9712735478",,,,,1,Bowker Books in Print,[2023-11-28],,,31309332,"R., Jett",Checked out,4/6/2024,5/5/2024
253428032,Mga Paboritong Kulay ni Kris,1,"Villanueva, Rene",Author,,,Anvil Publishing Inc. (2019),2019,,,"Maraming paboritong kulay si Kris! Sa bilingguwal na seryeng ito para sa mga nakababatang mag-aaral, pagyayamanin ang kanilang bokabularyo sa pagkatuto ng mga kulay.[return]Kris has many favorite colors! In this bilingual series for early learners, kids will enrich their growing vocabulary by learning about colors.",,Mga Paboritong Kulay ni Kris by Rene Villanueva (2019),Board book,17 cm,,17 cm,,,17 cm,,,,,,4,,,"Your library, Board Books, Si Kris","Tagalog, English",Tagalog,,[9789712735509],"9789712735509, 9712735508",,,,,1,Bowker Books in Print,[2023-11-28],,,31309333,(No name),,,
253428046,"Let's Go, Intayon!: An Enchanting Dual-Language Picture Book in English and Ilocano. (English Ilocano Bilingual Book for Kids)",1,"Penhollow, Avi",Author,,,"Independently published (2023), 34 pages",2023,,,"Two languages, one heartwarming adventure![return]Join an adorable Filipino child and his mother on a colorful tour of their hometown's streets, sounds, and flavors. This bilingual book, written in English and Ilocano, is more than just a story; it's also a song about a parent's love for their child and the rich Filipino culture.[return]See the ""kalesa"" trot through Laoag[return]Hear the iconic jeepneys beeping[return]Smell the fragrant flowers at the market[return]Feel the warmth of a grandmother's hug[return]Taste the sweetness of ube ice cream[return]Whether you're introducing your child to Filipino heritage or simply looking for a heartwarming tale of family and sensory exploration, this book is an adventure for all five senses.",,"Let's Go, Intayon!: An Enchanting Dual-Language Picture Book in English and Ilocano. (English Ilocano Bilingual Book for Kids) by Avi Penhollow (2023)",Paperback,34 p.; 8.5 inches,,8.5 inches,0.08 inches,8.5 inches,8.5 x 8.5 x 0.08 inches,34,,,,,5,,,Your library,"Iloko, English",,,[9798861718813],9798861718813,,,,,1,amazon.com books,[2023-11-28],,,31309334,(No name),,,
253428058,"Filipino Children's Favorite Stories: Fables, Myths and Fairy Tales (Favorite Children's Stories)",1,"Romulo, Liana",Author,,,"Tuttle Publishing (2020), Edition: Illustrated, 64 pages",2020,,,"This colorfully illustrated multicultural children's book presents Philippine fairy tales and other folk stories—providing insight into a rich storytelling culture.[return][return]Filipino Children's Favorite Stories presents thirteen well-loved myths and tales from the Philippines. These stories will enchant 5 to 10-year-old readers around the world with their wit and charm. Many of the tales have been transmitted from mother to child over centuries, and cover classic childhood themes—such as the forces of good triumphing over evil, children rebelling against evil adults and the weak prevailing over the strong. They make perfect new additions for story time or bedtime reading.[return][return]Narrated with an international audience in mind and illustrated with whimsical watercolors by award-winning artist Joanne de Leon, this is a must-have collection of tales for anyone interested in the Philippines or Filipino culture.[return][return]Featured Filipino stories include:[return]Why Mosquitoes Buzz Around Our Ears: the story of an unforgiving crab king who finally meets his match[return]The Prince's Bride: a timeless tale that proves there's more to people than meets the eye[return]The Deer and the Snail: the story of a race, an arrogant deer and some very clever snail friends",,"Filipino Children's Favorite Stories: Fables, Myths and Fairy Tales (Favorite Children's Stories) by Liana Romulo (2020)",Hardcover,64 p.; 11.5 inches,1.2 pounds,11.5 inches,0.5 inches,9 inches,11.5 x 9 x 0.5 inches,64,,,,,6,,,Your library,English,English,PZ8.R664 F,[9780804850216],"9780804850216, 0804850216",,398.2,"Customs, Etiquette, Folklore > Folk literature > Folklore > Social sciences",,1,amazon.com books,[2023-11-28],,,414968,(No name),,,
253428065,Filipino Celebrations: A Treasury of Feasts and Festivals,1,"Romulo, Liana",Author,,,"Tuttle Publishing (2012), Edition: Bilingual, 48 pages",2012,,,"This multicultural children's book is full of Filipino holidays, culture, language and stories![return][return]In the Philippines, people love to celebrate—holidays are filled with music and dancing, sometimes with colorful costumes, and always with great food! Rich with detailed watercolors and cultural flavor, Filipino Celebrations: A Treasury of Feasts and Festivals makes major holidays (like Christmas) and family gatherings (like weddings and birthdays) come alive.[return][return]From these pages, children will learn the history of each holiday, its cultural influences, the varied ways in which people celebrate in different regions of the Philippines, special customs and food, key words and phrases (in English and Tagalog), and more. Games, songs, and other activities invite young readers to join in the fun. New and familiar holidays take on a special flavor as children learn about the diverse cultures that make up this wonderful island nation. Perfect for Filipino-American families looking to share the unique culture of the Philippines, educators interested in promoting multiculturalism in the classroom, or anyone interested in the country, Filipino Celebrations will encourage children ages five to ten to participate and learn while having fun.[return][return]Celebrations and festivals include:[return]Mga Kaarawan — Birthdays[return]Semana Santa — Holy Week[return]Mga Barrio Fiestas — Town Festivals[return]Mga Binyag — Baptisms[return]Araw ng Kalayaan — Independence Day and more!",,Filipino Celebrations: A Treasury of Feasts and Festivals by Liana Romulo (2012),Hardcover,48 p.; 10.5 x 8.5 inches,1.1243575362 pounds,8.5 inches,0.4 inches,10.5 inches,8.5 x 10.5 x 0.4 inches,48,,,,,7,,,Your library,English,English,GT4881.A2 R66,[9780804838214],"9780804838214, 0804838216",,394.269599,"Customs, Etiquette, Folklore > General Customs > History, geographic treatment, biography > Holidays > Social sciences > Special Occasions",,1,amazon.com books,[2023-11-28],,,13589064,(No name),,,
253428071,Filipino Friends,1,"Romulo, Liana",Author,,,"Tuttle Publishing (2006), Edition: Illustrated, 32 pages",2006,,,"Travel to the Philippines without leaving home![return][return]From the author of Filipino Children's Favorite Stories comes a book for young children that features a Filipino-American boy visiting the Philippines for the very first time. Each watercolor illustration is labeled with English words and their Filipino translations and shows readers both the similarities and differences between Western and Philippine lifestyles. Filipino Friends, perfect for Filipino-American's or those just interested in the culture, is indispensable in bridging the gap between the two cultures.[return][return]Following the sweet multicultural children's story, kids will learn about Philippine customs and traditions, including:[return]Filipino festivals and celebrations[return]Traditional dress[return]Snacks and meals[return]Songs and games[return]The Filipino language—Tagalog—and more!",,Filipino Friends by Liana Romulo (2006),Hardcover,32 p.; 10.5 x 9.5 inches,1.1243575362 pounds,9.5 inches,0.3 inches,10.5 inches,9.5 x 10.5 x 0.3 inches,32,,,,,8,,,Your library,"English, Tagalog",English,DS663 .R66,[9780804838221],"9780804838221, 0804838224",,959.9,Asia > History and Geography > Southeast Asia > The Philippines,,1,amazon.com books,[2023-11-28],,,8576577,(No name),,,
253428087,My First Book of Colors and Shapes/Ang Aking Unang Aklat ng Mga Kulay at Hugis,1,"Suzara-Cheng, Jennifer",Author,,,"Indy Pub (2020), 20 pages",2020,,,"This book part of the Children's Nature Book Series (Bi-Lingual English Tagalog) for Global Filipinos. These BILINGUAL and ENVIRONMENTAL picture books series are conceptualized for the millions of descendants of Filipinos living in different parts of the world called GLOBAL FILIPINOS. It is the author's goal to plant a seed in the minds of future generations, and make a connection between the children's place of birth and the land of their ancestors using language as a springboard. At the same time, she also wants to open their young eyes to nature by providing pictures instead of cartoonish depictions of living organisms. By doing so, the author sincerely hopes to help awaken in the hearts of new generations of Global Filipinos, love for the PHILIPPINES and the ENVIRONMENT.[return][return]Purchased at https://www.filam-ecograndma.com/",,My First Book of Colors and Shapes/Ang Aking Unang Aklat ng Mga Kulay at Hugis by Jennifer Suzara-Cheng (2020),Paperback,20 p.; 9.02 inches,0.110231131 pounds,9.02 inches,0.05 inches,5.98 inches,9.02 x 5.98 x 0.05 inches,20,,,,,9,,,Your library,"Tagalog, English",,,[9781087913797],"9781087913797, 1087913799",,,,,1,amazon.com books,[2023-11-28],,,31309342,(No name),,,
253428089,My First Book of Animals; Ang Aking Unang Aklat ng mga Hayop,1,"Suzara-Cheng, Jennifer",Author,,,"www.filam-ecograndma.com (2020), 20 pages",2020,,,"This book on animals is the first in the Children's Nature Book Series (Bi-Lingual English Tagalog) for Global Filipinos. These BILINGUAL and ENVIRONMENTAL picture books series are conceptualized for the millions of descendants of Filipinos living in different parts of the world called GLOBAL FILIPINOS. It is the author's goal to plant a seed in the minds of future generations, and make a connection between the children's place of birth and the land of their ancestors using language as a springboard. At the same time, she also wants to open their young eyes to nature by providing pictures instead of cartoonish depictions of living organisms. By doing so, the author sincerely hopes to help awaken in the hearts of new generations of Global Filipinos, love for the PHILIPPINES and the ENVIRONMENT.[return][return]Purchased at https://www.filam-ecograndma.com/",,My First Book of Animals; Ang Aking Unang Aklat ng mga Hayop by Jennifer Suzara-Cheng (2020),Paperback,20 p.; 9 inches,0.110231131 pounds,9 inches,0.05 inches,6 inches,9 x 6 x 0.05 inches,20,,,,,10,,,Your library,"Tagalog, English",,,[9781087878737],"9781087878737, 108787873X",,,,,1,amazon.com books,[2023-11-28],,,31309343,(No name),,,
253428106,My First Book of Counting/Ang Aking Unang Aklat ng Pagbibilang,1,"Suzara-Cheng, Jennifer",Author,,,"Indy Pub (2020), 20 pages",2020,,,"This book on counting belongs in the Children's Nature Book Series (Bi-Lingual English Tagalog) for Global Filipinos. These BILINGUAL and ENVIRONMENTAL picture books series are conceptualized for the millions of descendants of Filipinos living in different parts of the world called GLOBAL FILIPINOS. It is the author's goal to plant a seed in the minds of future generations, and make a connection between the children's place of birth and the land of their ancestors using language as a springboard. At the same time, she also wants to open their young eyes to nature by providing pictures instead of cartoonish depictions of living organisms. By doing so, the author sincerely hopes to help awaken in the hearts of new generations of Global Filipinos, love for the PHILIPPINES and the ENVIRONMENT.[return][return]Purchased at https://www.filam-ecograndma.com/",,My First Book of Counting/Ang Aking Unang Aklat ng Pagbibilang by Jennifer Suzara-Cheng (2020),Paperback,20 p.; 9.02 inches,0.110231131 pounds,9.02 inches,0.05 inches,5.98 inches,9.02 x 5.98 x 0.05 inches,20,,,,,11,,,Your library,"Tagalog, English",,,[9781087908274],"9781087908274, 1087908272",,,,,1,amazon.com books,[2023-11-28],,,31309350,(No name),,,
253428110,My First Book of Plants: Ang Aking Unang Aklat ng Halaman (2),1,"Suzara-Cheng, Jennifer",Author,,,"www.filam-ecograndma.com (2020), Edition: Bilingual English-Tagalog ed., 20 pages",2020,,,This is a book for children of Global Filipinos who would like to introduce them to Tagalog Language using living organisms as a springboard. It is the author's goal to plant a seed in the young minds of the future generation the love for environment and the Philippines.[return][return]Purchased at https://www.filam-ecograndma.com/,,My First Book of Plants: Ang Aking Unang Aklat ng Halaman (2) by Jennifer Suzara-Cheng (2020),Paperback,20 p.; 9 inches,0.110231131 pounds,9 inches,0.05 inches,6 inches,9 x 6 x 0.05 inches,20,,,,,12,,,Your library,"Tagalog, English",,,[9781735611006],"9781735611006, 173561100X",,,,,1,amazon.com books,[2023-11-28],,,31309352,(No name),,,
253428116,Eat Your Garden (English-Filipino Edition),1,"Santos, Lorie",Author,,,"Www.Filam-Ecograndma.com (2022), 20 pages",2022,,,A child is afraid of the creepy crawlies in their garden. His mother convinces him that each creature has a role in that garden that is a miniature world of its own.[return][return]Purchased at https://www.filam-ecograndma.com/,,Eat Your Garden (English-Filipino Edition) by Lorie Santos (2022),Paperback,20 p.; 8.5 inches,0.14991433816 pounds,8.5 inches,0.05 inches,8.5 inches,8.5 x 8.5 x 0.05 inches,20,,,,,13,,,Your library,"Tagalog, English",,,[9781737280903],"9781737280903, 1737280906",,,,,1,amazon.com books,[2023-11-28],,,31309355,(No name),Available @ Jamba (Old Pasadena),4/21/2024,
253428121,Kumusta Baby!: Baby's First Tagalog Words (Filipino Children's Books),1,"Leslie-Quinones, Melissa J",Author,,,"Independently published (2019), 43 pages",2019,,,"Artist Melissa Leslie-Quinones created 'Kumusta Baby!' as a book for her girls and all the beautiful babies around the globe who love the Filipino culture and language. As a first generation Filipino American, it is her honor to be able to pass on the beautiful language of Tagalog to the next generation. The hand drawn imagery of baby's first words are frequently used around the home as well as images that babies are drawn to such as animals that make familiar sounds that peak baby's interest.Be sure to find 'Kumusta Baby!' activity book that includes more Tagalog words!",,Kumusta Baby!: Baby's First Tagalog Words (Filipino Children's Books) by Melissa J Leslie-Quinones (2019),Paperback,43 p.; 8.25 inches,,8.25 inches,0.11 inches,8.25 inches,8.25 x 8.25 x 0.11 inches,43,,,,,14,,,Your library,"Tagalog, English",,,[9781070727233],"9781070727233, 1070727237",,,,,1,amazon.com books,[2023-11-28],,,31309357,"F., Aileen",Checked out,4/26/2024,5/25/2024
253428125,Nurse Mommies are the Best!,1,"Cheng, Annie",Author,"Basbas, Fer",Illustrator,UbeBooks.com,2021,,,Why are nurse mommies the best? A child explains why in this book that is filled with colorful images of Filipino life and culture. Have fun reading this with your kids!,,Nurse Mommies are the Best! by Annie Cheng (2021),Paperback,22 p.; 10 inches,,10 inches,,,10 inches,22,,,,,15,,"picturebook, nurses, nanay, mother, Tagalog, English, bilingual",Your library,"Tagalog, English",Multiple languages,,[9798985106732],9798985106732,,,,,2,amazon.com books,[2023-11-28],,,31309358,(No name),,,
253428136,Nurse Ube Sings Karaoke,1,"Cheng, Annie",Author,,,"Ube Books LLC (2022), 34 pages",2022,,,"Join Nurse Ube and friends enjoy a favorite Filipino activity at Magic Karaoke. This book is part of the Nurse Ube series that celebrates the Filipino Nursing community and showcases Filipino food, culture, and values, with some humor intertwined. Nurse Ube reminds us of the fun-loving spirit and sense of camaraderie of the Filipino people.",,Nurse Ube Sings Karaoke by Annie Cheng (2022),Paperback,34 p.; 11 inches,0.29101018584 pounds,11 inches,0.09 inches,8.5 inches,11 x 8.5 x 0.09 inches,34,,,,,16,,,Your library,"Tagalog, English",,,[9798985106749],9798985106749,,,,,1,amazon.com books,[2023-11-28],,,31309361,(No name),,,
253428145,Ocean Adventure (English-Tagalog Edition),1,"Suzara-Cheng, Jennifer",Author,,,"Www.Filam-Ecograndma.com (2022), Edition: Tagalog, Filipino ed., 28 pages",2022,,,"Maddie and her family embark on a fresh adventure of discovery and fun in this new book from filam-ecograndma.com. Ocean Adventure features marine life and the many dangers they face due to the massive pollution of our oceans, particularly as a result of improper disposal of trash and plastic products. This is the English-Tagalog Edition.[return][return]Purchased at https://www.filam-ecograndma.com/",,Ocean Adventure (English-Tagalog Edition) by Jennifer Suzara-Cheng (2022),Paperback,28 p.; 8.5 inches,0.18959754532 pounds,8.5 inches,0.08 inches,8.5 inches,8.5 x 8.5 x 0.08 inches,28,,,,,17,,,Your library,"Tagalog, English",,,[9781737280989],"9781737280989, 1737280981",,,,,1,amazon.com books,[2023-11-28],,,31309364,(No name),Available @ Jamba (Old Pasadena),4/21/2024,
253428148,Tide Pool Adventure (English-Tagalog Edition),1,"Suzara-Cheng, Jennifer",Author,,,"Www.Filam-Ecograndma.com (2021), 24 pages",2021,,,"Maddie and her brothers Zach and Josh love going to the beach with their mom and dad. In this story, they discover fun and interesting facts about tidepools and the creatures that live in them. Tide Pool Adventure features detailed, artistic renderings of the vibrant marine life that exists in small pools that are created when the tides recede. Tide pools form shelters for various marine life and serve as nurseries for various species of sea animals. Read Tide Pool Adventure with your kids to learn with Maddie and her family how to help preserve and protect this vital feature of our natural environment.[return][return]Purchased at https://www.filam-ecograndma.com/",,Tide Pool Adventure (English-Tagalog Edition) by Jennifer Suzara-Cheng (2021),Paperback,24 p.; 8.5 inches,0.1763698096 pounds,8.5 inches,0.07 inches,8.5 inches,8.5 x 8.5 x 0.07 inches,24,,,,,18,,,Your library,"Tagalog, English",,,[9781737280941],"9781737280941, 1737280949",,,,,1,amazon.com books,[2023-11-28],,,31309366,(No name),Available @ Jamba (Old Pasadena),4/21/2024,
253428154,Rom-rom and Lola,1,"Similar, Rowena",Author,,,"Independently published (2020), 38 pages",2020,,,"Rom-rom stays with Lola (Grandmother) while his parents go to work. At his Lola’s house, Rom-rom learns household items, songs and honoring-gestures in Filipino. He also gets exposure to the most important part of the culture… delicious Filipino food! This is a great addition to any classroom wishing to promote multiculturalism. It is also perfect for parents wanting to teach their children unique Filipino traditions and terminology. Rom-rom and Lola will allow children to learn while having lots of fun!",,Rom-rom and Lola by Rowena Similar (2020),Paperback,38 p.; 10 inches,0.29 pounds,10 inches,0.09 inches,8 inches,10 x 8 x 0.09 inches,38,,,,,19,,,Your library,"English, Tagalog",,,[9798652735968],9798652735968,,,,,1,amazon.com books,[2023-11-28],,,31309368,(No name),Available @ Jamba (Old Pasadena),4/21/2024,
253428159,But That Won't Make Me Sleep,1,"Pacaña-Lumbao, Annie",Author,,,"Adarna House, Inc.",2013,,,"Maya is having a hard time going to sleep. Nanay has tried almost everything, but Maya still lies awake with her eyes wide open. What is keeping Maya from falling asleep?[return][return]Nahihirapan si Maya na makatulog. Nasubok na ni Nanay halos lahat, pero dilat na dilat pa ring nakahiga si Maya. Ano kaya ang pumipigil sa antok ni Maya?",,But That Won't Make Me Sleep by Annie Pacaña-Lumbao (2013),Paperback,,,,,,,,,,,,20,,,Your library,"Tagalog, English",,,[9715084508],"9715084508, 9789715084505",,899.21134,"Literature > Literature of other languages > Malay and Austronesian languages > Other Literature: Pacific Islands, Basque, Artificial Languages, Georgia, Mesopotamia   > Philippine languages > Tagalog (Filipino) > Tagalog fiction",,1,amazon.com books,[2023-11-28],,,20928773,(No name),,,
253428160,Super Maya,1,"Rodriguez, Bambi A",Author,,,"Independently published (2022), 33 pages",2022,,,"4-year old Maya is a child who is hard of hearing (HOH). She is new in town and certainly new in school. She is excited about going to class, trying the different art materials, experiencing new toys and trying out the school’s playground! Maya is also excited about meeting new friends, but is not sure how to do this or how they will react to her being hard of hearing. Join Maya as she learns how to navigate her new school environment and learn how to make new friends in the process.",,Super Maya by Bambi A Rodriguez (2022),Paperback,33 p.; 8.5 inches,,8.5 inches,0.08 inches,8.5 inches,8.5 x 8.5 x 0.08 inches,33,,,,,21,,,Your library,"Tagalog, English",,,[9798365874558],9798365874558,,,,,1,amazon.com books,[2023-11-28],,,31309371,"F, Jenn",Checked out,3/24/2024,4/7/2024
253428162,Elias and the Bikol River,1,"Santos, Lorie",Author,,,"Www.Filam-Ecograndma.com (2020), Edition: 2nd ed., 32 pages",2020,,,"Elias and the Bikol River is the story of a young kid who longs to fish for his cat and swim in the river. When he goes to the Bikol River, he catches a can of sardines instead of real fish. Elias learns that he, along with his friends and other people, can help make the river clean again.[return][return]Elias and the Bikol River was first published by the Ina nin Bikol Foundation, Inc. in 2017 under the title ""Si Elias asin ang Salog Naga"". The story won the 'Sa Ugoy ng Inang Wika Contest' of the De la Salle University's Bienvenido N. Santos Creative Writing Center in 2017.[return][return]A portion of the sales from this book, and others in the series, will be donated to Sumaro sa Salog Inc. (SULOG), the lead proponent of Irukan which will house the Emelina G. Regis Sanctuary of Native Trees in Naga City, Philippines.[return][return]Purchased at https://www.filam-ecograndma.com/",,Elias and the Bikol River by Lorie Santos (2020),Paperback,32 p.; 9 inches,0.16093745126 pounds,9 inches,0.09 inches,6 inches,9 x 6 x 0.09 inches,32,,,,,22,,,Your library,"Tagalog, Bikol",English,,[9781735611013],"9781735611013, 1735611018",,,,,1,amazon.com books,[2023-11-28],,,31309372,(No name),,,
