Book Id,Title,Sort Character,Primary Author,Primary Author Role,Secondary Author,Secondary Author Roles,Publication,Date,Review,Rating,Comment,Private Comment,Summary,Media,Physical Description,Weight,Height,Thickness,Length,Dimensions,Page Count,LCCN,Acquired,Date Started,Date Read,Barcode,BCID,Tags,Collections,Languages,Original Languages,LC Classification,ISBN,ISBNs,Subjects,Dewey Decimal,Dewey Wording,Other Call Number,Copies,Source,Entry Date,From Where,OCLC,Work id,Lending Patron,Lending Status,Lending Start,Lending End
257715576,Sandangaw : a Waray tale = Hi Sandangaw : usa nga susumaton,1,"Oyzon, Voltaire Q.",,"Alunan, Merlie M.|Sunga, Ray|Ramos, Firie Jill T.",Translator.|Illustrator.|Translator.,Sari-Sari Storybooks,2019,,,"Little Sandangaw might just be a handspan tall, but he wants to do all the things that bigger children do. If only his family weren’t so afraid he’d be blown away, dragged, or stepped on! When the village magic woman tells him to visit the Eagle of Mt. Danglay for help, Sandangaw learns what it takes to grow.",,Sandangaw : a Waray tale = Hi Sandangaw : usa nga susumaton by Voltaire Q. Oyzon (2019),Paper Book,28 p.; 26 cm,,26 cm,,,26 cm,28,2018967686,[2024-02-03],,,105,,,Your library,"English, Waray",Waray,PZ7.O89 S3,[9781733533508],"9781733533508, 1733533508",Children Conduct of life Juvenile fiction|Conduct of Life Juvenile Fiction|Conduct of Life Juvenile fiction|Conduct of life Juvenile Fiction|Conduct of life Juvenile fiction|Eagles Fiction|Eagles Juvenile fiction|Maturation (Psychology) Juvenile fiction|Resourcefulness Fiction|Resourcefulness Juvenile fiction,,,,1,"San Francisco Public Library (San Francisco, CA)",[2024-02-05],,,24915338,"G, Ana",Checked out,3/10/2024,3/24/2024
257715796,Kalipay and the Tiniest Tiktik : a Cebuano Tale,1,"Newhard, Christina",Author,"Garaje, Happy|Bering, Jona Branzuela",Illustrator.|Translator.,Sari-Sari Storybooks,2017,,,"Daydreaming comes easily to Kalipay, but she doesn’t know how to make bullies leave her alone. One day, she makes an unusual new friend in Gamay, who tells the school bully, Juan, to stop teasing Kalipay. Other children are afraid of Gamay—her strange tongue, split body, and bat wings—but Kalipay is fascinated by the things that make her new friend different. Together they learn how friendship can overcome differences and create happiness for everyone. This book is in English and Cebuano.",,Kalipay and the Tiniest Tiktik : a Cebuano Tale by Christina Newhard (2017),Paper Book,26 cm,,26 cm,,,26 cm,,2017903620,[2024-02-03],,,106,,,Your library,"English, Cebuano",,PZ7.N49 K,[9780997864137],"9780997864137, 0997864133","Animals, Mythical Juvenile fiction|Animals, mythical Juvenile fiction|Bullies and bullying|Bullying Juvenile fiction|FRIENDSHIP FICTION|Friendship FICTION|Friendship FIction|Friendship Fiction|Friendship Juvenile Fiction|Friendship Juvenile fiction|Friendship fiction|Friendship juvenile fiction|Individual differences Juvenile fiction|Mythical animals Fiction|Play Fiction|Play Juvenile fiction|Play fiction|friendship fiction",,,,1,"San Francisco Public Library (San Francisco, CA)",[2024-02-05],,ocn981991549,24915331,"R, Melanie",Checked out,3/3/2024,3/17/2024
257715883,Pitong Tsinelas,1,"Reyes, Divine Gil",Author,"Catindig, Benjor",Illustrator,"Ilaw ng Tahanan Publishing, Inc.",2018,,,"Pitong Tsinelas is a story about coming together despite our differences. Its charming story of inclusivity and acceptance will resonate with children and parents from all walks of life.[return]Originally developed by Tahanan Books for Young Readers in collaboration with the Save The Children Philippines under its First Read program, Pitong Tsinelas was created to help kids from 1 to 4 years old learn how to count through the concept of inclusivity. It’s never too early to introduce children to relevant social issues. After all, it takes a village to raise a child.",,Pitong Tsinelas by Divine Gil Reyes (2018),Board book,,,,,,,,,[2024-02-03],,,107,,,Your library,Tagalog,Tagalog,,[9786214220175],"9786214220175, 6214220171",,,,,1,amazon.com books,[2024-02-05],,,23163889,(No name),,,
257715999,Rom-rom Counts to Ten: An English/Filipino Counting Book,1,"Similar, Rowena",Author,"Del Rosario, Jhucel",Illustrator,Independently published,2021,,,"Rom-rom brings a Polaroid camera to document his first trip to the Philippines. His mission is to photograph interesting places, items, and delicious food unique to the country. Count one jeepney (isang dyipni), two mangoes (dalawang mangga), and three tricycles (tatlong traysikel) with Rom-rom. Explore the Philippines with your little ones as they count from 1 to 10 in English and Filipino.",,Rom-rom Counts to Ten: An English/Filipino Counting Book by Rowena Similar (2021),Paperback,29 p.; 8.5 inches,0.21 pounds,8.5 inches,0.07 inches,8.5 inches,8.5 x 8.5 x 0.07 inches,29,,[2024-02-03],,,108,,,Your library,"English, Tagalog",English,,[9798710871959],9798710871959,,,,,1,amazon.com books,[2024-02-05],,,31653045,(No name),Available @ Jamba (Old Pasadena),4/21/2024,
257716481,Sayaw ng mga kamay,1,"Que, Joanna",,"Alvarez, Fran",Illustrator.,"[Quezon City, Philippines] : Adarna House, 2020.",2020,,,Sayaw ng mga Kamay is an uplifting story about a friendship overcoming disability barriers with Filipino Sign Language.,,Sayaw ng mga kamay by Joanna Que (2020),Paper Book,31 p.; 29 cm,,29 cm,,,29 cm,31,,,,,109,,,Your library,Tagalog,,,[9789715088268],"9789715088268, 9715088260",Dance Fiction|Dance for children Juvenile fiction|Hand Movements Juvenile fiction,899.21134,"Literature > Literature of other languages > Malay and Austronesian languages > Other Literature: Pacific Islands, Basque, Artificial Languages, Georgia, Mesopotamia   > Philippine languages > Tagalog (Filipino) > Tagalog fiction",,1,"San Francisco Public Library (San Francisco, CA)",[2024-02-05],,,31653134,(No name),,,
257717282,Jalal and the Lake : a Meranaw Tale,1,"Usman, Hanna",,,,Sari-Sari Storybooks,2023,,,"In Jalal’s small village, everyone celebrates the bounty and beauty of their vast lake. Everyone, that is, except Jalal. Jalal doesn’t notice the lake, its bounty, or his people’s wishes. His only desire is to own the magical, puffy clouds in the sky. When strange men come to the village and offer to grant his wish, Jalal finally learns what the lake means to his people.",,Jalal and the Lake : a Meranaw Tale by Hanna Usman (2023),Hardcover,,,,,,,,,[2024-02-03],,,110,,,Your library,"English, Philippine (Other)",,,[9781733533522],"9781733533522, 1733533524",,,,,1,manual entry,[2024-02-05],,,31653183,"G, Ana",Checked out,3/10/2024,3/24/2024
257719087,Melo the Umang-boy : an Ivatan tale,1,"Sarmiento-Co, Alyssa",,"Newhard, Christina|Portez, Jaypee|Valiente, Criselda",Author.|Illustrator.|Translator.,"[Brooklyn, New York] : Sari-Sari Storybooks, 2017.",2017,,,"Melo is a painfully shy little boy living with his grandmother and uncle. One day he visits a magical, busy city on the bottom of the ocean, filled with talking sea creatures. Disaster strikes the city, and he must overcome his shyness to help the sea creatures rebuild. This book is bilingual, in English and Ivatan.",,Melo the Umang-boy : an Ivatan tale by Alyssa Sarmiento-Co (2017),Paper Book,26 cm,,26 cm,,,26 cm,,2016912480,[2024-02-03],,,111,,,Your library,"English, Philippine (Other)",,PZ8.1.S276 2016,[9780997864106],"9780997864106, 0997864109",Bashfulness Fiction|Bashfulness in children Juvenile fiction|Boys Fiction|Boys Juvenile fiction|Cities and towns Fiction|Cities and towns Juvenile fiction|Marine Animals fiction|Marine animals Fiction|Marine animals Juvenile Fiction|Marine animals Juvenile fiction,398.2/73/09599[E],"Customs, Etiquette, Folklore > Folk literature > Folklore > Social sciences",,1,"San Francisco Public Library (San Francisco, CA)",[2024-02-05],,,24915336,(No name),,,
257721304,Modista ang Tatay ko,1,"Tepace, Alita",Author,"Maramba, Quinnie",Illustrator,,,,,"This book is about the story of Judy and her dressmaker father. Judy’s classmates are amused about how good her father is in making dresses for women. However, they questioned the role of her father in her family just because of his job. Judy felt sad and asked his father about this. Her father then explained to her what is more important than prescribing the roles of man and woman in the society.",,Modista ang Tatay ko by Alita Tepace,Paperback,,,,,,,28,,[2024-02-03],,,112,,,Your library,"Tagalog, English",,,[9789710745166],"9789710745166, 9710745166",,,,,1,manual entry,[2024-02-05],,,31653654,(No name),,,
257721460,Si Faisal at si Farida,1,"Garlitos, Rhandee",Author,"Garanchon, Tinsley",Illustrator,,,,,"Para sa mga kaibigan nila, sina Faisal at Farida ay tila nababalot ng misteryo. Bakit laging may dalang kakaibang puting libro si Faisal? Bakit lagi nakatakip ang ulo ni Farida? Nilalarawan ng Si Faisal at si Farida ang pagkahalina ng bata sa mga taong iba ang kultura, sa isang kalugod-lugod na kuwento ng pag-unawa at pagkakaibigan. Itinuturo rin sa kuwentong ito ang pagiging bukas ng isipan pagdating sa pagkaka-iba-iba ng bawa’t isa.",,Si Faisal at si Farida by Rhandee Garlitos,Paperback,,,,,,,,,[2024-02-03],,,113,,,Your library,"Tagalog, English",,,[9789710151257],"9789710151257, 9710151258",,,,,1,manual entry,[2024-02-05],,,31653667,(No name),,,
257721570,Si Ayen at ang Pinakamagandang Pangalan,1,"Pulido, Heather Ann F.",Author,"Abreu, Juno",Illustrator,,,,,"Ayen has a long list of beautiful names. She uses one of these names every time she plays. For some reason though, she doesn’t like to use her real name. Her classmates and friends even tease Ayen about it. That was until her mother comes up with the beautiful reason behind Ayen’s name.",,Si Ayen at ang Pinakamagandang Pangalan by Heather Ann F. Pulido,Paperback,,,,,,,28,,[2024-02-03],,,114,,,Your library,"Tagalog, English",,,[9789710745241],"9789710745241, 9710745247",,,,,1,manual entry,[2024-02-05],,,31653687,(No name),,,
257721798,May Lakad Kami ni Tatay,1,"Evasco, Eugene Y.",Author,"Sabas, Brent",Illustrator,,,,,Father and son are going on a trip. Where are they going? What are they going to do? This book reminds children the importance of exercise in having a healthy mind and body. It also introduces different models who may serve as examples in relation to fitness and active lifestyle.,,May Lakad Kami ni Tatay by Eugene Y. Evasco,Paperback,,,,,,,28,,[2024-02-03],,,115,,,Your library,"Tagalog, English",,,[9789710151721],"9789710151721, 971015172X",,,,,1,manual entry,[2024-02-05],,,18301286,(No name),,,
257721980,Ang Kahon ng Pabaon,1,"Evasco, Eugene Y.",Author,"Penaflorida, Tokwa S.",Illustrator,,,,,"Ipinapakita sa librong ito ang paraan ng isang bata upang makapagtabi ng mga munti at masasayang alaala para sa isang kaibigang lilipat ng bansa. Ibinabahagi ng kuwentong ito na sa pagkakaibigan, hindi alintana ang panahon at distansiya.",,Ang Kahon ng Pabaon by Eugene Y. Evasco,Paperback,,,,,,,28,,[2024-02-03],,,116,,,Your library,"Tagalog, English",,,[9789710742882],"9789710742882, 9710742884",,,,,1,manual entry,[2024-02-05],,,31653718,(No name),,,
257732184,"PAGTULOG NA, NENE",1,"Alegre, Hermes",Illustrator,"Alegre, Hermes",Illustrator,TAHANAN BOOKS,2017,,,"“Pagtulog na, Nene” is a gentle lullaby from the Hiligaynon-speaking people of Panay Island in western Visayas, Philippines. The name “Nene” is a term of endearment for a female child or a young woman in the Visayas, and even in Luzon. Today, the song is frequently rendered in arranged choral style because of its sweet melody and flowing rhythm. It is possible that there are other versions of this lullaby, since folk songs are an oral tradition. They are shaped and reshaped over time by the people that sing them.",,"PAGTULOG NA, NENE by Hermes Alegre (2017)",Paperback,,,,,,,,,[2024-02-03],,,117,,,Your library,"Hiligaynon, English",,,[9786214220137],"9786214220137, 6214220139",,781.62992122,Folk music {equally instrumental and vocal} > General principles and musical forms > Music > Pacific > The arts > Traditions of music,,1,amazon.com books,[2024-02-05],,,23359115,(No name),,,
257732608,Sali Ako!,1,"Reyes, Alyssa",Author,"Espiritu, Iori",Illustrator,,,,,"Naiiba sina Puti at Itim sa mga hayop sa kagubatan. Ang isa ay masyadong maliit, at ang isa naman ay masyadong malaki. Makahanap kaya sila ng kalaro at kaibigan kahit kakaiba ang kanilang anyo?",,Sali Ako! by Alyssa Reyes,Paperback,,,,,,,32,,[2024-02-03],,,118,,,Your library,Tagalog,Tagalog,,[9789712735790],"9789712735790, 9712735796",,,,,1,manual entry,[2024-02-05],,,31654639,"R., Jett",Checked out,4/6/2024,5/5/2024
257736437,"Si Tasha, ang Mamag na Maikli ang Pasensiya",1,"Tejido, Jomike",Author,,,,,,,"Tasha's patience is really short. She easily gets annoyed when she doesn't get what she wants. With the help of her mother, Tasha learns simple ways to calm down during stressful situations.",,"Si Tasha, ang Mamag na Maikli ang Pasensiya by Jomike Tejido",Paperback,,,,,,,19,,[2024-02-03],,,119,,,Your library,"Tagalog, English",,,[9789712735356],"9789712735356, 9712735354",,,,,1,manual entry,[2024-02-05],,,31654992,(No name),,,
257736520,Pag-uwi ni Mommy,1,"Contreras-Cabrera, Manuelita",,,,Chikiting Books.,2019,,,"This is about Karla whose mother is working abroad. She grew up with her lola and tita. One day, her lola tells her that her mother is finally coming home. Karla doesn’t know what to feel about the news. She thought of the words that her classmates say about her mother. Despite this, Karla reminds herself of how much her mother loves her and couldn’t wait for her return.",,Pag-uwi ni Mommy by Manuelita Contreras-Cabrera (2019),Paper Book,,,,,,,,,,,,120,,,Your library,"Tagalog, English",,,[9789710745159],"9789710745159, 9710745158",,,,,1,"San Francisco Public Library (San Francisco, CA)",[2024-02-05],,,31654995,(No name),,,
257736622,Superwoman si Inay!,1,"Matias Jr., Segundo D.",,,,Lampara Publishing House,2009,,,"Kilalang-kilala si Nanay Doris sa buong baryo dahil marunong siyang mag-manicure at pedicure. Kilala rin siya dahil sa kanyang bayong na punung-puno ng mga bagay na itinitinda niya nang pahulugan.[return]Ngunit higit pa roon ang kaya niyang gawin. Bilang nanay, may katangian si Nanay Doris kung bakit kayang-kaya niyang ibigay ang lahat ng hinihingi ng kanyang mga anak.[return]Basahin sa kuwentong ito kung bakit ang galing-galing talaga ni Nanay Doris.[return][return][return]Mommy Doris is well known in town because she does manicures and pedicures.[return]She is also popular of her big bayong filled with items she sells on installment basis. But she can also do better. As a mother, Mommy Doris has a quality that makes her capable of providing anything her children need.[return]Read in this story why Mommy Doris is really awesome.",,Superwoman si Inay! by Segundo D. Matias Jr. (2009),Paperback,,,,,,,32,2013307060,[2024-02-03],,,121,,,Your library,"Tagalog, English",,,[9789715183895],"9789715183895, 9715183891",,,,,1,"Library of Congress (Washington, DC)",[2024-02-05],,,27083474,"Cyndi T, Child of",Checked out,4/7/2024,5/5/2024
257736823,Amina and the city of flowers = Si Amina y el cuidad de maga flores : a Chavacano tale/un cuento Chavacano,1,"Newhard, Christina",,"Bautista, Robbie|Pantaleta, Floraime",Illustrator.|Translator.,Sari-Sari Storybooks,2017,,,"Amina, a young Yakan weaver, is homesick for Basilan, but she finds inspiration for her loom in the diversity and color of her new home, Zamboanga City.",,Amina and the city of flowers = Si Amina y el cuidad de maga flores : a Chavacano tale/un cuento Chavacano by Christina Newhard (2017),Paperback,26 cm,,26 cm,,,26 cm,,2017903621,[2024-02-03],,,122,,,Your library,"English, Philippine (Other)",,PZ7.N49 A,[9780997864168],"9780997864168, 0997864168",Multiculturalism|Multiculturalism Philippines Fiction|Multiculturalism Philippines Juvenile fiction|PHILIPPINES|Philippines|REFUGEES|Refugees|Refugees Philippines Fiction|Refugees Philippines Juvenile fiction|Weavers|Weavers Philippines Fiction|Weavers Philippines Juvenile fiction|Zamboanga City (Philippines) Fiction|Zamboanga City (Philippines) Juvenile fiction|multiculturalism|philippines|refugees,,,,1,"University of Michigan (Ann Arbor, MI)",[2024-02-05],,,24915329,"K., Ashley",Checked out,4/6/2024,5/5/2024
257736970,Every Sunday Tuwing Linggo,1,"Gonzalez, Och",Author,"Reynaldo, Cj",Contributor,"Kahel Press (2020), 32 pages",2020,,,"Kuya Berto, the ice cream vendor, is really cool! I want to be friends with him but I don't know how to talk to him. He can't hear and I also don't know sign language. How can we be friends?",,Every Sunday Tuwing Linggo by Och Gonzalez (2020),Paperback,32 p.; 8 inches,0.18959754532 pounds,8 inches,0.09 inches,8 inches,8 x 8 x 0.09 inches,32,,[2024-02-03],,,123,,,Your library,"English, Tagalog",English,,[971625444X],"971625444X, 9789716254440",,,,,1,amazon.com books,[2024-02-05],,,29328991,(No name),,,
257737177,Maya at Laya,1,"Laxa-Pangilinan, Maricel",Author,"Bauza, Jamie",Illustrator,,,,,"Maya and Laya are sisters that both love to play, but they just can’t seem to play well together. Maya is quiet and Laya is loud. One is neat and the other is messy. When their differences collide into one big mess, how will they ever learn to get along?",,Maya at Laya by Maricel Laxa-Pangilinan,Paperback,,,,,,,,,,,,124,,,Your library,"Tagalog, English",,,[9789712735929],"9789712735929, 9712735923",,,,,1,manual entry,[2024-02-05],,,31655021,"K., Ashley",Checked out,4/6/2024,5/5/2024
257795700,TAKBO! Mga Pandiwa,1,"Yambao, Auri Asuncion",Illustrator,,,,,,,"Welcome to a playground of words where sound makes sense.[return][return]The Filipino language has many onomatopoeic words, each carrying a sound that describes its meaning. Inside these pages you will find THIRTY-NINE ILLUSTRATED VERBS that say what they mean.[return][return]Auri Asuncion Yambao’s brilliant graphics make Filipino words so easy for children to learn and remember.",,TAKBO! Mga Pandiwa by Auri Asuncion Yambao,Paperback,,,,,,,,,[2024-02-03],,,125,,,Your library,Tagalog,Tagalog,,[9786214220014],"9786214220014, 6214220015",,,,,1,manual entry,[2024-02-06],,,24157291,(No name),,,
257845323,May Tiyanak sa Loob ng Aking Bag,1,"Evasco, Eugene Y.",,,,,,,,"Kay sarap magtampisaw sa maliliksing salita ng mga tula; kay inam maligo sa ambon ng nakakakiliting tunog ng taludtod; kay sayang makipaglaro sa maririkit na larawan sa librong ito! -Heidi Emily Eusebio-Abad, premyadong kuwentista para sa mga bata",,May Tiyanak sa Loob ng Aking Bag by Eugene Y. Evasco,Paperback,,,,,,,80,,[2024-02-03],,,126,,,Your library,Tagalog,Tagalog,,[9789712726521],"9789712726521, 9712726525",,899.2111,"Literature > Literature of other languages > Malay and Austronesian languages > Other Literature: Pacific Islands, Basque, Artificial Languages, Georgia, Mesopotamia   > Philippine languages > Tagalog (Filipino) > Tagalog poetry",,1,manual entry,[2024-02-07],,,15352177,(No name),,,
257845426,Ma-me-mi-mumu!,1,"Tejido, Jomike",,,,,,,,"This not-so-scary picture book by National Children’s Book Awardee Jomike Tejido, casts Filipino supernatural creatures in a fresh, amusing light. Young readers will identify with young Haya Sophia as she overcomes her fear of monsters with the help of her Lolo Nanding.[return][return]This book includes a gallery of Filipino supernatural creatures on pages 30-31.",,Ma-me-mi-mumu! by Jomike Tejido,Paperback,,,,,,,,,[2024-02-03],,,127,,,Your library,"Tagalog, English",All,,[9789716301755],"9789716301755, 9716301758",,,,,1,manual entry,[2024-02-07],,,22230857,(No name),,,
257845699,"Mommy ni Kuya, Mommy Ko!",1,"Matias Jr., Segundo D.",,,,,,,,"Mayroong pinagseselosan si Angel. Mayroon siyang kinaiinggitan.[return][return]Sino? Ang kanyang kuya. Lagi na long kasing si Kuya Victor ang maasikaso ng kanilang mommy.[return]Ano ba kasing mayroon si Kuya Victor? Da pat ay malaman at maintindihan ni Angel ang kalagayan nilang magkapatid—at ng kanilang mommy.[return][return]There is someone Angel is jealous of. There is someone she is envious of. Who? Her elder brother. It is because too often it is Kuya Victor whom their mommy is taking care of. Just what does Kuya Victor have? Angel should know and understand her and her brother's situation—and their mother's, too.",,"Mommy ni Kuya, Mommy Ko! by Segundo D. Matias Jr.",Paperback,,,,,,,32,,[2024-02-03],,,128,,,Your library,"Tagalog, English",,,[9789715187541],"9789715187541, 9715187544",,,,,1,manual entry,[2024-02-07],,,31667521,(No name),,,
257846438,"Si Lin-lin, Ang Mahiyaing Balintong",1,"Tejido, Jomike",,,,,,,,"Lin-lin gets so shy about everything that she curls up and rolls away! Through the help of Coach Maya and her classmates, Lin-lin discovers an unexpected talent and learns that it’s okay to be herself.   [return]Lagi na lang nahihiya si Lin-lin kaya namamaluktot siya’t gumugulong palayo. Sa tulong ni Coach Maya at kaniyang mga kaklase, natuklasan ni Lin-lin ang kaniyang kakaibang talino at natutunan niyang na ayos lang maging totoo sa sarili.",,"Si Lin-lin, Ang Mahiyaing Balintong by Jomike Tejido",Paperback,,,,,,,19,,[2024-02-03],,,129,,,Your library,"Tagalog, English",,,[9789712735370],"9789712735370, 9712735370",,,,,1,manual entry,[2024-02-07],,,31667575,(No name),,,
257846917,Araw sa Palengke,1,"Tobias-Papa, May",Author,"Roxas, Isabel",Illustrator,,,,,"I’m coming with Nanay! We’re going to the market. What would we see there? Who would I meet? Come, join us! Today is market day![return][return]Sasama ako kay Nanay! Pupunta kami sa palengke. Ano-ano kaya ang makikita namin doon? Sino-sino kaya ang makikilala ko? Tara, sama ka. Ngayon ay araw ng palengke!",,Araw sa Palengke by May Tobias-Papa,Paperback,,,,,,,,,[2024-02-03],,,130,,,Your library,"Tagalog, English",,,[9789715083171],"9789715083171, 971508317X",,,,,1,manual entry,[2024-02-07],,,15356387,(No name),,,
257847034,Rom-rom Counts to Ten,1,"Similar, Rowena",,,,,,,,"Rom-rom brings a Polaroid camera to document his first trip to the Philippines. His mission is to photograph interesting places, items, and delicious food unique to the country. Count one jeepney (isang dyipni), two mangoes (dalawang mangga), and three tricycles (tatlong traysikel) with Rom-rom. Explore the Philippines with your little ones as they count from 1 to 10 in English and Filipino.",,Rom-rom Counts to Ten by Rowena Similar,Hardcover,,,,,,,,,[2024-02-03],,,131,,,Your library,"English, Tagalog",,,[9781666237009],"9781666237009, 1666237000",,,,,1,manual entry,[2024-02-07],,,31653045,(No name),,,
257847129,Alam ni Kris ang Magkakasalungat na Salita,1,"Villanueva, Rene",,,,,,,,"Gustong-gusto ni Kris na matulog sa ilalim ng upuan, pero minsan, gusto rin niyang matulog sa ibabaw nito. Minsan, puno ang mangkok niya, ngunit minsan, wala itong laman! Sa bilingguwal na seryeng ito na para sa mga nakababatang mag-aaral, pagyayamin ang kanilang bokabularyo sa pagkatuto ng mga salitang magkakasalungat ang kahulugan.[return][return]Kris loves to sleep under the chair, but, sometimes, Kris loves to sleep on the chair. Sometimes, Kris's bowl is full, but sometimes it's empty! In this bilingual series for early learners, kids will enrich their growing vocabulary by learning about opposites.",,Alam ni Kris ang Magkakasalungat na Salita by Rene Villanueva,Board book,,,,,,,,,,,,132,,,Your library,"Tagalog, English",,,[9789712735479],"9789712735479, 9712735478",,,,,1,manual entry,[2024-02-07],,,31309332,"L., Louis",Checked out,4/6/2024,5/5/2024
257975312,Mabuhay,1,"Sterling, Zachary",,,,Graphix,2023,,,"From rising star Zachary Sterling comes a humorous and heartwarming middle-grade graphic novel that celebrates food, family, and folklore.[return][return]Can two kids save the world and work their family food truck?[return][return]First-generation Filipino siblings JJ and Althea struggle to belong at school. JJ wants to fit in with the crowd, while Althea wants to be accepted as she is. To make matters worse, they have to help their parents run the family food truck by dressing up as a dancing pig and passing out samples. Ugh! And their mom is always pointing out lessons from Filipino folklore -- annoying tales they've heard again and again. But when witches, ogres, and other creatures from those same stories threaten their family, JJ and Althea realize that the folklore may be more real that they'd suspected. Can they embrace who they really are and save their family?",,Mabuhay by Zachary Sterling (2023),Comic book,,,,,,,231,,,,,133,,,Your library,"English, Tagalog",,PZ7.S7442 M,[9781338738605],"9781338738605, 1338738607",,741.50,"Cartoons, Caricatures, Comics > Cartoons, Caricatures, Comics > Drawing &  drawings > Graphic arts and decorative arts > The arts",,1,manual entry,[2024-02-10],,,30403369,(No name),,,
